OI;28/06/2011;41017765;SAO LUIZ GONZAGA C E E FUND MEDIO;MAMBORE;PR
OI;30/12/2009;41017862;EMILIO DE MENEZES E M ED INF ENS FUND;PEABIRU;PR
OI;30/12/2009;41017889;ISABEL E M PRINCESA ED INF ENS FUND;PEABIRU;PR
OI;30/12/2008;41017935;OLAVO BILAC C E E FUND MEDIO;PEABIRU;PR
OI;30/12/2008;41017943;QUATORZE DE DEZEMBRO C E E FUND MED;PEABIRU;PR
OI;30/12/2009;41017994;SAO JOSE E M ED INF ENS FUND SEDE;PEABIRU;PR
OI;30/12/2008;41018966;BASILIO PERTSEW C E E FUND MEDIO;ANGULO;PR
OI;30/12/2009;41018982;ADOLPHO O FRANCO C E GOV E F MED PROF;ASTORGA;PR
OI;30/12/2009;41019008;ALFREDO SOFIENTINI E M ED INF ENS FUND;ASTORGA;PR
OI;30/12/2009;41019016;AMABILE T POZZOBON E M ED INF ENS FUND;ASTORGA;PR
OI;30/12/2009;41019032;ANTENOR BALAROTTI E M ED INF ENS FUND;ASTORGA;PR
OI;30/12/2009;41019067;CELSO E M MONSENHOR ED INF ENS FUND;ASTORGA;PR
OI;01/09/2010;41019083;EGIDIO BALLAROTTI C E E FUND MEDIO;ASTORGA;PR
OI;30/12/2009;41019164;MARIA C MACHADO E M PROFA ED INF E FUND;ASTORGA;PR
OI;30/12/2009;41019229;SERAFIM FRANCA C E E FUND MED;ASTORGA;PR
OI;01/09/2010;41019261;VERISSIMO DE SOUZA E E E FUND;ASTORGA;PR
OI;30/12/2008;41019296;HUMBERTO DE CAMPOS C E E FUND MEDIO;ATALAIA;PR
OI;30/12/2009;41019342;VANIA MARIA SIMAO E M ED INF ENS FUND;ATALAIA;PR
OI;30/12/2008;41019350;ARTHUR DA C SILVA C E PRES E FUND MEDIO;CAFEARA;PR
OI;30/12/2009;41019369;CAFEARA E M DE ED INF ENS FUND;CAFEARA;PR
OI;30/12/2009;41019490;JOSE DE ANCHIETA E M ENS FUND;CENTENARIO DO SUL;PR
OI;30/12/2008;41019504;JOSE PIRES C E PE E FUND MEDIO;CENTENARIO DO SUL;PR
OI;30/12/2009;41019539;OSMUNDA E M IRMA ENS FUND;CENTENARIO DO SUL;PR
OI;30/12/2009;41019610;SAO JOSE E M E FUND;CENTENARIO DO SUL;PR
OI;30/12/2009;41019636;ANTONIO BERTONI E M PROF ENS FUND;COLORADO;PR
OI;30/12/2009;41019652;CECILIA MEIRELES E E E FUND;COLORADO;PR
OI;30/12/2009;41019709;LUIS SHUZI OURA E M PROF ENS FUND;COLORADO;PR
OI;30/12/2009;41019717;PAULO FREIRE E M ENS FUND;COLORADO;PR
OI;30/12/2009;41019733;MILTON SA SANTOS E M PROF ENS FUND;COLORADO;PR
OI;30/12/2008;41019741;MONTEIRO LOBATO C E E FUND MED NOR PRO;COLORADO;PR
OI;01/06/2010;41019750;PEDRO FRANCISCO DE ALCANTARA E M E F;COLORADO;PR
OI;30/12/2009;41019776;TEREZA CRISTINA C E E FUND MEDIO;COLORADO;PR
OI;30/12/2009;41019806;CAXIAS E M DUQUE DE E FUND;FLORIDA;PR
OI;30/12/2008;41019814;DENISE C ALBUQUERQUE C E PROFA E F M;FLORIDA;PR
OI;30/12/2008;41019830;CARMELA DUTRA C E E FUND MEDIO;GUARACI;PR
OI;30/12/2009;41019911;WILSON JAN DE GIULI E M E FUND;GUARACI;PR
OI;30/12/2008;41019920;CYRO P DE CAMARGO C E E FUND MEDIO;IGUARACU;PR
OI;30/12/2008;41019938;IGUARACU E M DE E FUND;IGUARACU;PR
OI;30/12/2009;41019970;FABIO DIAS DA SILVA E M ED INF E FUND;ITAGUAJE;PR
OI;30/12/2008;41019989;LOURDES A MELO C E E FUND MEDIO;ITAGUAJE;PR
OI;30/12/2008;41020065;NEWTON GUIMARAES E M PROF E FUND;JAGUAPITA;PR
OI;30/12/2009;41020073;NILSON RIBAS C E DR E MEDIO NORMAL;JAGUAPITA;PR
OI;30/12/2009;41020170;WALDEMIRO PEDROSO E E DR E FUND;JAGUAPITA;PR
OI;30/12/2008;41020189;OSVALDO ARANHA E E E FUND;LOBATO;PR
OI;30/12/2009;41020197;RUI BARBOSA C E E MEDIO;LOBATO;PR
OI;06/09/2011;41020219;CARLOS GOMES E M E FUND;LUPIONOPOLIS;PR
OI;30/12/2008;41020235;GUIDO MARIA CONFORTI E M ED INF E FUND;LUPIONOPOLIS;PR
OI;30/12/2008;41020251;MACHADO DE ASSIS C E E FUND MEDIO;LUPIONOPOLIS;PR
OI;30/12/2008;41020286;FRANCISCO J PERIOTO E E PROF E FUND;MANDAGUACU;PR
OI;30/12/2008;41020294;GILSON BELANI E M E FUND;MANDAGUACU;PR
OI;30/12/2008;41020367;PARIGOT DE SOUZA C E E FUND MED PROF;MANDAGUACU;PR
OI;30/12/2008;41020413;RIO BRANCO E M BAR DO E FUND;MANDAGUACU;PR
OI;30/12/2008;41020430;SANTO CARRARO E M E FUND;MANDAGUACU;PR
OI;27/07/2011;41020464;ANGELO LOPES E R M DR E FUND;MUNHOZ DE MELO;PR
OI;27/07/2011;41020480;FERNAO DIAS E E E FUND;MUNHOZ DE MELO;PR
OI;30/12/2008;41020499;JOSE F SALDANHA C E ENG E FUND MEDIO;MUNHOZ DE MELO;PR
OI;30/12/2009;41020529;VICENTE LIBERATO E M ENS FUND;MUNHOZ DE MELO;PR
;01/09/2010;41020545;FRANCISCA S RUIZ E M PROFA ENS FUND;NOSSA SENHORA DAS GRACAS;PR
OI;30/12/2008;41020553;IVAN F A SILVA FILHO C E DR E FUND MED;;PR
OI;30/12/2009;41020570;ANA RITA DE CASSIA E M E FUND;NOVA ESPERANCA;PR
OI;01/03/2011;41020642;COSTA MONTEIRO C E E FUND MEDIO;NOVA ESPERANCA;PR
OI;30/12/2009;41020677;FILOMENA MONARO ZANUSSO E M E INF FUN;NOVA ESPERANCA;PR
OI;30/12/2009;41020685;FRANCISCO P X LOPES E E CON E FUND;NOVA ESPERANCA;PR
OI;30/12/2009;41020731;JORGE FANECO E M VER ED INF ENS FUND;NOVA ESPERANCA;PR
OI;30/12/2009;41020740;JULIO BENATTI E M E FUND;NOVA ESPERANCA;PR
OI;23/06/2011;41020758;LADISLAU BAN E M PE ED INF ENS FUND;NOVA ESPERANCA;PR
OI;27/07/2011;41020766;LUCENA E E BARAO DE E FUND;NOVA ESPERANCA;PR
OI;30/12/2009;41020774;NICE BRAGA E M EDUC INF ENS FUND;NOVA ESPERANCA;PR
OI;30/12/2008;41020820;SAO VICENTE DE PAULA C E E F E M N PR;NOVA ESPERANCA;PR
OI;30/12/2009;41020839;TANCREDO NEVES E M ED INF ENS FUND;NOVA ESPERANCA;PR
OI;30/12/2009;41020863;IROI E M E FUND;PRESIDENTE CASTELO BRANCO;PR
OI;30/12/2009;41020871;MARIA C N DE SOUZA C E E FUND MEDIO;;PR
OI;30/12/2008;41020898;ARTHUR DA C E SILVA C E MAL E FUN MED;SANTA FE;PR
OI;30/12/2009;41020910;CECILIA MEIRELES E E E FUND;SANTA FE;PR
OI;30/12/2009;41020928;9 DE DEZEMBRO E M ENS FUND;SANTA FE;PR
OI;11/09/2009;41020960;HILDA TEIXEIRA COUTINHO E M E INF FUN;SANTA INES;PR
OI;09/11/2009;41020979;SANTA INES C E E FUND MEDIO;SANTA INES;PR
OI;30/12/2008;41021010;MANOEL F ALMEIDA E E DR E FUND;SANTO INACIO;PR
OI;30/12/2008;41021029;OMAR DE OLIVEIRA E M E FUND;SANTO INACIO;PR
OI;30/12/2008;41021037;PEDRO I C E DOM E FUND E MEDIO;SANTO INACIO;PR
OI;30/12/2008;41021053;HERVAL C E MARQUES DE E FUND MEDIO;UNIFLOR;PR
OI;30/12/2009;41021070;MENINO JESUS E M ED INF ENS FUND;UNIFLOR;PR
OI;30/12/2009;41021100;ANASTACIO CEREZINE E E E FUND;ALVORADA DO SUL;PR
OI;30/12/2008;41021800;VITORIA REGIA E M E FUND;FLORESTOPOLIS;PR
OI;30/12/2008;41021819;ARNALDO BUSATO C E E FUND MEDIO;MIRASELVA;PR
OI;30/12/2008;41021827;JULIA WANDERLEY C E E FUND MEDIO;PRADO FERREIRA;PR
OI;30/12/2009;41021860;FRANCO PASINI E M PE ED INF ENS FUND;PORECATU;PR
OI;30/12/2008;41021932;MALVINO DE OLIVEIRA C E PRF E F M PROF;PORECATU;PR
OI;30/12/2008;41021983;RICARDO LUNARDELLI C E E F MED NOR PROF;PORECATU;PR
OI;15/05/2013;41022025;TIRADENTES E M ED INF ENS FUND;PORECATU;PR
OI;30/12/2009;41022041;ANA FERREIRA GOES E M ED INF ENS FUND;PRIMEIRO DE MAIO;PR
OI;30/12/2008;41022050;CASTELO BRANCO C E MAL E FUND MED NOR;PRIMEIRO DE MAIO;PR
OI;30/12/2009;41022076;CECILIA MEIRELES E M ED INF ENS FUND;PRIMEIRO DE MAIO;PR
OI;21/09/2011;41022106;IBIACI E M DE EDUC INF ENS FUND;PRIMEIRO DE MAIO;PR
OI;23/08/2011;41022122;MONTEIRO LOBATO E M ED INF ENS FUND;PRIMEIRO DE MAIO;PR
OI;30/12/2009;41022823;DOMINGOS L VITORINO E M PROF E FUND;ITAMBE;PR
OI;30/12/2008;41022831;GIAMPERO MONACCI E E PROF E FUND;ITAMBE;PR
OI;30/12/2009;41022840;OLAVO BILAC C E E FUND E MEDIO;ITAMBE;PR
OI;30/12/2009;41022866;AFRANIO PEIXOTO E M ED INF ENS FUND;IVATUBA;PR
OI;30/12/2008;41022874;SAO FCO DE ASSIS C E E FUND MEDIO;IVATUBA;PR
OI;30/12/2008;41022890;BENOIL F M BOSKA C E PROF E FUND MEDIO;OURIZONA;PR
OI;30/12/2009;41022920;ROCHA POMBO E M ED INF ENS FUND;OURIZONA;PR
OI;30/12/2008;41022955;MARCIA VAZ T ABREU C E E FUND MED;SAO JORGE DO IVAI;PR
OI;30/12/2008;41022980;SAO JORGE E M E FUND;SAO JORGE DO IVAI;PR
OI;30/12/2009;41022998;ARY DA CUNHA PEREIRA E M DR E FUND;MANDAGUARI;PR
OI;30/12/2009;41023005;BOM PASTOR E M E FUND;MANDAGUARI;PR
OI;30/12/2009;41023030;WALTER ANTUNES PEREIRA E M E INF E FUND;MANDAGUARI;PR
OI;30/12/2009;41023056;FRANCISCO ROMAGNOLE JR E M E INF E FUND;MANDAGUARI;PR
OI;30/12/2009;41023080;JOSE LUIZ GORI C E E FUND MEDIO PROF;MANDAGUARI;PR
OI;30/12/2009;41023161;SAO VICENTE PALLOTTI E E E FUND;MANDAGUARI;PR
OI;30/12/2009;41023188;VERA CRUZ C E E FUND MED PROFIS NORM;MANDAGUARI;PR
OI;30/12/2009;41023196;YOLANDA C DA SILVA E M PROFA E FUND;MANDAGUARI;PR
OI;07/09/2011;41023226;BENEDITO R DE SOUZA E E E FUND;MARIALVA;PR
OI;30/12/2008;41023242;FELIPE S BITTENCOURT C E DR E FUND MED;MARIALVA;PR
OI;27/07/2011;41023277;GUITI SATO E M ED INF ENS FUND;MARIALVA;PR
OI;30/12/2008;41023307;MARIA DOS S SEVERINO E M ED INF E FUND;MARIALVA;PR
OI;30/12/2008;41023315;JURACY R S ROCHA C E E FUND MED PROF;MARIALVA;PR
OI;30/12/2008;41023331;MILTON T PAES E M DR ED INF ENS FUND;MARIALVA;PR
OI;30/12/2008;41023358;NILO PECANHA E M ED INF ENS FUND;MARIALVA;PR
OI;30/12/2008;41023366;NILSON BATISTA RIBAS E E E FUND;MARIALVA;PR
OI;30/12/2008;41023382;PEDRO V PARIGOT DE SOUZA C E E F M N P;MARIALVA;PR
OI;01/09/2010;41023439;ROMARIO MARTINS C E E FUND MEDIO;MARIALVA;PR
OI;01/07/2011;41023471;SAO MIGUEL DO CAMBUI E M E INF ENS FUND;MARIALVA;PR
OI;30/12/2009;41023536;ADAILE M LEITE C E E FUND MEDIO;MARINGA;PR
OI;30/12/2009;41023544;AGMAR DOS SANTOS E M PROF E INF ENS FUND;MARINGA;PR
OI;30/12/2008;41023552;ALBERTO J BYINGTON JR C E E FUND MEDIO;MARINGA;PR
OI;30/12/2008;41023560;ALFREDO MOISES MALUF C E E FUND MEDIO;MARINGA;PR
OI;30/12/2008;41023587;ANGELINA L MENEGUETTI EM DONA E I E F;MARINGA;PR
OI;30/12/2009;41023595;ANICETO MATTI E M MAESTRO ED INF E FUND;MARINGA;PR
OI;30/12/2009;41023633;ARIOVALDO MORENO E M E FUND;MARINGA;PR
OI;30/12/2009;41023641;AYRTON PLAISANT E M E FUND;MARINGA;PR
OI;30/12/2009;41023676;BENEDITA N LIMA E M PROFA E INF FUND;MARINGA;PR
OI;30/12/2008;41023706;BRANCA DA MOTA FERNANDES C E E F M PR;MARINGA;PR
OI;30/12/2008;41023714;BRASILIO ITIBERE C E E FUND MEDIO;MARINGA;PR
OI;30/12/2008;41023773;CAMPOS SALLES E M E FUND;MARINGA;PR
OI;30/12/2008;41023811;CAXIAS C E DUQUE DE E FUND MEDIO;MARINGA;PR
OI;30/12/2009;41023927;DIRCE DE A MAIA C E E FUND MEDIO;MARINGA;PR
OI;30/12/2008;41023978;ELVIRA B DOS SANTOS E E E FUND;MARINGA;PR
OI;30/12/2009;41024036;GABRIELA MISTRAL E M E FUND;MARINGA;PR
OI;30/12/2008;41024044;GASTAO VIDIGAL C E DR E FUN MED PROF;MARINGA;PR
OI;30/12/2008;41024052;HELENTON B CORTES E M DR ED INF E FUND;MARINGA;PR
OI;30/12/2008;41024060;INSTITUTO DE ED EST MARINGA E F M N PROF;MARINGA;PR
OI;30/12/2008;41024079;IPIRANGA E E E FUND;MARINGA;PR
OI;27/07/2011;41024087;CELESTIN FREINET E M ED INF ENS FUND;MARINGA;PR
OI;30/12/2008;41024095;MIDUFO VADA E M PROF ED INF ENS FUND;MARINGA;PR
OI;30/12/2009;41024117;JOAO B SANCHES E M DOUTOR E INF E FUND;MARINGA;PR
OI;30/12/2008;41024125;JOAO DE F PIOLI C E E FUND MEDIO;MARINGA;PR
OI;30/12/2008;41024141;JOAO XXIII C E E FUND MED;MARINGA;PR
OI;30/12/2009;41024338;MIRIAM L PALANDRI E M PROFA E INF E FUN;MARINGA;PR
OI;30/12/2009;41024389;NADYR M ALEGRETTI E M PROFA E I E F;MARINGA;PR
OI;27/07/2011;41024419;APLICACAO PED DA UEM C DE E FUND MED;MARINGA;PR
OI;30/12/2008;41024427;OCTAVIO PERIOTTO E M ED INF ENS FUND;MARINGA;PR
OI;30/12/2009;41024435;ODETE R GOMES DE CASTRO E M E FUND;MARINGA;PR
OI;30/12/2009;41024443;ODETTE A ROSA E M PROFA E INF ENS FUND;MARINGA;PR
OI;30/12/2009;41024451;OSCAR P DOS SANTOS E M ED INF ENS FUND;MARINGA;PR
OI;30/12/2008;41024460;OSVALDO CRUZ E M DR E FUND;MARINGA;PR
OI;30/12/2009;41024486;MILTON SANTOS E M PROF ED INF FUND;MARINGA;PR
OI;30/12/2009;41024494;PARQUE ITAIPU C E DO E FUND MEDIO;MARINGA;PR
OI;01/03/2011;41024559;MARIANA V DIAS E M PIONEIRA E INF E FUN;MARINGA;PR
OI;30/12/2009;41024567;PIVENI P MORAES E M PROFA ED INF E FUND;MARINGA;PR
OI;30/12/2009;41024621;RENATO BERNARDI E M PROF ED INF E FUND;MARINGA;PR
OI;30/12/2008;41024630;RODRIGUES ALVES C E E FUND MEDIO;MARINGA;PR
OI;30/12/2009;41024648;ROSA PALMA PLANAS E M ED INF ENS FUND;MARINGA;PR
OI;30/12/2009;41024656;RUI BARBOSA C E E FUND MEDIO;MARINGA;PR
OI;27/12/2013;41024664;RUY ALVINO ALEGRETTI E M E INF FUND;MARINGA;PR
OI;30/12/2008;41024680;SANTA MARIA GORETTI C E E FUND MED PROF;MARINGA;PR
OI;30/12/2009;41024729;SILVIO M BARROS C E E FUND MEDIO;MARINGA;PR
OI;30/12/2008;41024761;TANCREDO DE A NEVES C E E FUND MEDIO;MARINGA;PR
OI;30/12/2008;41024788;THEOBALDO M SANTOS C E E FUND MEDIO;MARINGA;PR
OI;30/12/2008;41024796;TOMAZ E DE A VIEIRA C E E FUND MEDIO;MARINGA;PR
OI;30/12/2009;41024818;ULYSSES GUIMARAES E M DEP FED DR E I E F;MARINGA;PR
OI;30/12/2008;41024834;UNIDADE POLO C E E FUND MEDIO PROF;MARINGA;PR
OI;30/12/2008;41024869;VINICIUS DE MORAIS C E E FUND MEDIO;MARINGA;PR
OI;30/12/2008;41024877;VITAL BRASIL C E E FUND MEDIO;MARINGA;PR
OI;30/12/2009;41024893;ANGELO BANKI E M PE ED INF ENS FUND;PAICANDU;PR
OI;30/12/2009;41024915;HEITOR DE A FURTADO E E E FUND;PAICANDU;PR
OI;30/12/2009;41024923;IZABEL E E PRINCESA E FUND;PAICANDU;PR
OI;30/12/2009;41024931;NEIDE BERTASSO BERALDO C E E F M;PAICANDU;PR
OI;30/12/2009;41024940;JOSE DE ANCHIETA C E E FUND MED;PAICANDU;PR
OI;30/12/2009;41024958;LUCILIA V FERRARI E M PROFA E I E F;PAICANDU;PR
OI;30/12/2009;41024966;MARIA APARECIDA LACAL E M PROFA E I E F;PAICANDU;PR
OI;30/12/2008;41024982;PAICANDU C E E FUND MEDIO NORMAL PROF;PAICANDU;PR
OI;30/12/2009;41024990;PEDRO FRANCOZO E M E FUND;PAICANDU;PR
OI;30/12/2008;41025008;PRUDENTE DE MORAIS E M DR ED INF E FUND;PAICANDU;PR
OI;30/12/2009;41025016;SANTOS DUMONT E M ED INF ENS FUND;PAICANDU;PR
OI;30/12/2008;41025040;VERCINDES G DOS REIS C E E MEDIO;PAICANDU;PR
OI;30/12/2008;41025059;ANTONIO FCO LISBOA C E EN FUN MED PRO;SARANDI;PR
OI;30/12/2009;41025067;AYRES ANICETO ANDRADE E M E INF ENS FUN;SARANDI;PR
OI;30/05/2011;41025083;CECILIA MEIRELES E M POET E INF E FUND;SARANDI;PR
OI;30/12/2009;41025091;CRIANCA ESPERANCA E M ED INF ENS FUND;SARANDI;PR
OI;30/12/2008;41025105;JARDIM INDEPENDENCIA C E DO E FUND MED;SARANDI;PR
OI;30/12/2009;41025113;JARDIM PANORAMA C E FUND MEDIO;SARANDI;PR
OI;30/12/2009;41025148;JOSE POLO E M ED INF ENS FUND;SARANDI;PR
OI;30/12/2009;41025172;MACHADO DE ASSIS E M ED INF ENS FUND;SARANDI;PR
OI;30/12/2009;41025180;MASAMI KOGA E M ED INF ENS FUND;SARANDI;PR
OI;30/12/2009;41025199;MAURO PADILHA E M ED INF ENS FUND;SARANDI;PR
OI;30/12/2009;41025202;MERCEDES R PANZERI E M ED INF ENS FUND;SARANDI;PR
OI;30/12/2008;41025237;OLAVO BILAC C E E FUND MEDIO;SARANDI;PR
OI;30/05/2011;41025245;OLINDA DIAS PEREIRA E M ED INF FUND;SARANDI;PR
OI;30/12/2009;41025253;SAO FRANCISCO DE ASSIS E M E INF E FUND;SARANDI;PR
OI;30/12/2009;41025261;TISURO TSUJI B CUNHA E M E I E FUND;SARANDI;PR
OI;30/12/2009;41025270;DARCI A PEREIRA MOCHI E M PROFA E I E F;SARANDI;PR
OI;30/12/2009;41025288;YOSHIO HAYASHI E M ED INF ENS FUND;SARANDI;PR
OI;30/12/2008;41025318;ALBERTO SANTOS DUMONT C E E F M PROF;APUCARANA;PR
OI;30/12/2008;41025326;ALBINO BIACCHI E M ENS FUND;APUCARANA;PR
OI;30/12/2009;41025342;ANTONIETA S LAUTENSCHLAGER E M E FUND;APUCARANA;PR
OI;24/08/2011;41025385;ANTONIO VIEIRA E M PE ENS FUND;APUCARANA;PR
OI;30/12/2008;41025415;AUGUSTO WEYAND E M E FUND;APUCARANA;PR
OI;30/12/2009;41025440;BENTO F DIAS E M PROF E FUND;APUCARANA;PR
OI;30/12/2008;41025482;CARLOS MASSARETTO C E PREF EN FUN MED;APUCARANA;PR
OI;30/12/2008;41025547;CRISTOVAO NOLLI E M PROF E FUND;APUCARANA;PR
OI;30/12/2008;41025563;DINARTE P DE ARAUJO E M E FUND;APUCARANA;PR
OI;30/12/2008;41025571;DURVAL PINTO E M PROF ED INF E FUND;APUCARANA;PR
OI;26/04/2012;41025598;EDSON GIACOMINI E M DR E FUND;APUCARANA;PR
OI;30/12/2009;41025636;FRANCISCO A SOUSA E E PROF E FUND;APUCARANA;PR
OI;30/12/2009;41025644;GABRIEL DE LARA E M E FUND;APUCARANA;PR
OI;30/12/2008;41025652;HEITOR C A FURTADO C E E FUND MED PRO;APUCARANA;PR
OI;30/12/2009;41025679;HUMBERTO DE A C BRANCO E M E FUND;APUCARANA;PR
OI;01/12/2010;41025687;IDALICE M PRATES E M PROF E FUND;APUCARANA;PR
OI;30/12/2008;41025695;IZIDORO L CERAVOLO C E PROF E F MED PROF;APUCARANA;PR
OI;30/12/2008;41025717;JOSE CANALE C E PE E FUND MEDIO;APUCARANA;PR
OI;30/12/2008;41025733;JOAO A BRAGA CORTES E M E FUND;APUCARANA;PR
OI;30/12/2008;41025741;JOAO BATISTA E M ENS FUND;APUCARANA;PR
OI;30/12/2009;41025750;JOAO XXIII E M PAPA ENS FUND;APUCARANA;PR
OI;30/12/2008;41025768;JOAQUIM V CASTRO E M DR E FUND;APUCARANA;PR
OI;30/12/2009;41025792;JOSE DE ALENCAR E M E FUND;APUCARANA;PR
OI;30/12/2008;41025806;JOSE DE ANCHIETA C E PE E F M P;APUCARANA;PR
OI;30/12/2008;41025822;JOSE I BRIANEZI E M ENS FUND;APUCARANA;PR
OI;30/12/2009;41025830;JOSE R DE OLIVEIRA E M VER E FUND;APUCARANA;PR
OI;30/12/2009;41025849;KAREL KOBER E M ENS FUND;APUCARANA;PR
OI;30/12/2008;41025857;LUIZ CARLOS PRESTES E M E FUND;APUCARANA;PR
OI;30/12/2009;41025865;LUIZ J DOS SANTOS C E CEL E FUND MED;APUCARANA;PR
OI;30/12/2009;41025890;MANOEL RIBAS, C AGRIC E - E FUND MED PRO;APUCARANA;PR
OI;30/12/2008;41025911;MARCOS DE B FREIRE E M SEN E FUND;APUCARANA;PR
OI;30/12/2009;41025938;MARTA P DA SILVA E M PROFA E FUND;APUCARANA;PR
OI;30/12/2009;41025962;MATEUS LEME E M ENS FUND;APUCARANA;PR
OI;30/12/2009;41025970;MEDICI E M PRES ENS FUND;APUCARANA;PR
OI;30/12/2008;41025997;NILO CAIRO C E E FUND MEDIO NORMAL;APUCARANA;PR
OI;30/12/2008;41026055;OSMAR GUARACY FREIRE C E E FUND MED;APUCARANA;PR
OI;30/12/2008;41026071;OSVALDO DOS SANTOS LIMA E M DR E FUND;APUCARANA;PR
OI;30/12/2008;41026144;PLACIDO DE CASTRO E M ENS FUND;APUCARANA;PR
OI;30/12/2008;41026152;POLIVALENTE APUCARANA C E E FUND MEDIO;APUCARANA;PR
OI;30/12/2009;41026233;SAO BARTOLOMEU C E E FUND MEDIO;APUCARANA;PR
OI;06/05/2011;41026284;TADASHI ENOMOTO C E E FUND MEDIO;APUCARANA;PR
OI;30/12/2008;41026322;VIDA NOVA E M ENS FUND;APUCARANA;PR
OI;09/01/2012;41026349;WILSON DE AZEVEDO E M PROF E FUND;APUCARANA;PR
OI;30/12/2009;41026373;ALBOR PIMPAO FERREIRA E M E FUND;ARAPONGAS;PR
OI;30/12/2009;41026381;ANESIO A DE AZEVEDO C E PROF E F M;ARAPONGAS;PR
OI;30/12/2009;41026390;ANTONIO M DE BARROS E M ENS FUND;ARAPONGAS;PR
OI;30/12/2008;41026403;ANTONIO G NOVAES C E E FUND MED E PRO;ARAPONGAS;PR
OI;30/12/2008;41026411;ANTONIO RACANELLO SAMPAIO C E E F MED;ARAPONGAS;PR
OI;30/12/2008;41026470;CARAVELAS C E MARQUES DE E F M E PROF;ARAPONGAS;PR
OI;30/12/2009;41026535;CHICO E M PE ENS FUND;ARAPONGAS;PR
OI;30/12/2009;41026551;CLOTARIO PORTUGAL E M DES ENS FUND;ARAPONGAS;PR
OI;30/12/2009;41026578;DIOMAR DE O PEGORER E M PROFA E FUND;ARAPONGAS;PR
OI;30/12/2008;41026586;EMILIO DE MENEZES C E E FUND MED NORM;ARAPONGAS;PR
OI;30/12/2008;41026632;FRANCISCO F BASTOS C E E FUND MEDIO;ARAPONGAS;PR
OI;30/12/2009;41026667;GERMANO MAYER E M PE ENS FUND;ARAPONGAS;PR
OI;30/12/2008;41026675;GETULIO VARGAS E M PRES ENS FUND;ARAPONGAS;PR
OI;30/12/2008;41026705;IVANILDE DE NORONHA C E E FUND MEDIO;ARAPONGAS;PR
OI;30/12/2009;41026730;JOARIB G CORDEIRO E M ENS FUND;ARAPONGAS;PR
OI;30/12/2009;41026748;JOSE B DOS SANTOS E M ENS FUND;ARAPONGAS;PR
OI;30/12/2008;41026764;JULIA WANDERLEY E E PROFA E FUND;ARAPONGAS;PR
OI;24/08/2011;41026772;JULIO JUNQUEIRA C E DR E FUND MEDIO;ARAPONGAS;PR
OI;30/12/2009;41026780;JULIO SAVIETO E M ENS FUND;ARAPONGAS;PR
OI;30/12/2009;41026870;NEREIDE S CAMARGO E M PROFA ENS FUND;ARAPONGAS;PR
OI;30/12/2008;41027060;UNIDADE POLO C E ENS FUND MED PROFIS;ARAPONGAS;PR
OI;30/12/2008;41027086;WALFREDO S CORREA C E E FUND MEDIO;ARAPONGAS;PR
OI;30/12/2009;41027116;CALIFORNIA E M E FUND;CALIFORNIA;PR
OI;30/12/2008;41027299;TALITA BRESOLIN C E E FUND MEDIO;CALIFORNIA;PR
OI;30/12/2009;41027310;CESAR LATTES C E ENS FUND MED;CAMBIRA;PR
OI;30/12/2008;41027370;ROSA D CALSAVARA C E E FUND MEDIO;CAMBIRA;PR
OI;30/12/2009;41027388;SAO JOSE E M E FUND;CAMBIRA;PR
OI;30/12/2008;41027442;CARLOS DE CAMPOS E E E FUND;JANDAIA DO SUL;PR
OI;30/12/2008;41027469;CESAR LATTES E M ED INF ENS FUND;JANDAIA DO SUL;PR
OI;30/12/2009;41027493;JOSE DE ANCHIETA E M PE ED INF E FUND;JANDAIA DO SUL;PR
OI;31/01/2012;41027515;GONCALVES DIAS E M ED INF ENS FUND;JANDAIA DO SUL;PR
OI;20/09/2011;41027523;HUMBERTO DE A C BRANCO E E E FUND;JANDAIA DO SUL;PR
OI;30/12/2008;41027558;JANDAIA DO SUL C E E FUND MED PROF;JANDAIA DO SUL;PR
OI;30/12/2008;41027590;JOHN KENNEDY E M ED INF ENS FUND;JANDAIA DO SUL;PR
OI;30/12/2008;41028406;ANDREA NUZZI C E MAESTRO E FUND MEDIO;CAMBE;PR
OI;08/06/2011;41028430;ANTONIO RAMINELLI C E E FUND MEDIO;CAMBE;PR
OI;30/12/2008;41028457;ATTILIO CODATO C E E FUND MEDIO;CAMBE;PR
OI;30/12/2009;41028511;CECILIA MEIRELES E M ED INF ENS FUND;CAMBE;PR
OI;30/12/2009;41028570;ERICO VERISSIMO C E E FUND MEDIO;CAMBE;PR
OI;30/12/2008;41028716;GERALDO FERNANDES C E DOM E FUND MED;CAMBE;PR
OI;30/12/2008;41028732;HELENA KOLODY C E PROF E FUND MEDIO;CAMBE;PR
OI;30/12/2009;41028740;HILDA SOARES E M IRMA E FUND;CAMBE;PR
OI;30/12/2008;41028988;OLAVO BILAC C E ENS FUND MED NOR PROF;CAMBE;PR
OI;30/12/2008;41028996;11 DE OUTUBRO C E E FUND MEDIO;CAMBE;PR
OI;30/12/2009;41029038;PEDRO TKOTZ E M ED INF ENS FUND;CAMBE;PR
OI;30/12/2009;41029054;ROBERTO CONCEICAO E M ED INF ENS FUND;CAMBE;PR
OI;01/01/2011;41029097;SANTOS DUMONT E M ENS FUND;CAMBE;PR
OI;30/12/2008;41029100;SAO JOSE E E E FUND;CAMBE;PR
OI;30/12/2009;41029119;SYMPHORIANO KOPF E M PE ED INF E FUND;CAMBE;PR
OI;30/12/2008;41029143;ANTONIO IGLESIAS C E E FUND MED PROF;IBIPORA;PR
OI;30/12/2009;41029151;BASILIO DE LUCCA C E ENS FUND MED;IBIPORA;PR
OI;01/09/2010;41029283;FRANCISCO G BELTRAO CEEBJA DR EF MED;IBIPORA;PR
OI;01/09/2010;41029291;GALDINA F GONCALVES E M PROF E FUND;IBIPORA;PR
OI;30/12/2008;41029305;JARDIM SAN RAFAEL C E DO E FUND MED;IBIPORA;PR
OI;30/12/2009;41029330;MARIA I R DE MELLO E M PROFA E FUND;IBIPORA;PR
OI;30/12/2009;41029348;MARIO DE MENEZES E M PREF ED INF FUND;IBIPORA;PR
OI;30/12/2008;41029356;OLAVO BILAC C E E FUND MEDIO PROF NOR;IBIPORA;PR
OI;30/12/2009;41029372;ROTARY CLUB E M ENS FUND;IBIPORA;PR
OI;30/09/2013;41029399;SEBASTIAO LUIZ DE OLIVEIRA E M E F;IBIPORA;PR
OI;30/12/2008;41029402;TEOTHONIO B VILELA C E E FUND MEDIO;IBIPORA;PR
OI;30/12/2008;41029445;UNIDADE POLO C E E FUND MEDIO;IBIPORA;PR
OI;30/12/2008;41033477;ODETE BORGES BOTELHO C E E FUND MEDIO;PITANGUEIRAS;PR
OI;30/12/2009;41033485;SANTO ANTONIO E M ED INF ENS FUND;PITANGUEIRAS;PR
OI;30/12/2008;41033507;ARTHUR DA C E SILVA E M ED INF E FUND;ROLANDIA;PR
OI;30/12/2009;41033558;FRANCISCO VILLANUEVA C E PROF E FUND MED;ROLANDIA;PR
OI;30/12/2008;41033566;GARRASTAZU MEDICI E M ED INF ENS FUND;ROLANDIA;PR
OI;30/12/2008;41033574;GERALDA C TIRADENTES E M E INF E FUND;ROLANDIA;PR
OI;26/08/2011;41033604;JOSE HERIONS C E PE E FUND MEDIO;ROLANDIA;PR
OI;30/12/2008;41033612;KENNEDY C E PRES E FUND MEDIO;ROLANDIA;PR
OI;30/12/2009;41033620;LAURO P TAVARES E E DR E FUND;ROLANDIA;PR
OI;26/05/2011;41033655;MARIA DO C CAMPOS E M ED INF ENS FUND;ROLANDIA;PR
OI;30/12/2008;41033663;MARIA T GEORG E M ED INF ENS FUND;ROLANDIA;PR
OI;08/06/2011;41033698;NOSSA SRA APARECIDA E M ED INF E FUND;ROLANDIA;PR
OI;12/09/2011;41033710;PARIGOT DE SOUZA E M ED INF ENS FUND;ROLANDIA;PR
OI;01/04/2011;41033809;SAO FERNANDO E M ED INF ENS FUND;ROLANDIA;PR
OI;30/12/2008;41033817;SOUZA NAVES C E E FUND MED PROF;ROLANDIA;PR
OI;30/12/2008;41033850;VITORIO FRANKLIN E M DR ED INF E FUND;ROLANDIA;PR
OI;30/12/2008;41033930;JOAO PAULO I C E E FUND MEDIO;BOM SUCESSO;PR
OI;30/12/2009;41033949;JOAO T MARABOLIN E M PROF ED INF E FUND;BOM SUCESSO;PR
OI;30/12/2009;41034112;BOSCO E M DOM ED INF ENS FUND;BORRAZOPOLIS;PR
OI;30/12/2009;41034244;HUMBERTO DE A C BRANCO E E E FUND;BORRAZOPOLIS;PR
OI;30/12/2008;41034309;JOSE DE ANCHIETA C E EF E MEDIO;BORRAZOPOLIS;PR
OI;30/12/2008;41034562;AUGUSTO BAHLS E E PROF E FUND;FAXINAL;PR
OI;30/12/2009;41034643;CECILIA MEIRELES E M ED INF ENS FUND;FAXINAL;PR
OI;30/12/2008;41034716;ERICO VERISSIMO C E E FUND MED NORM PRO;FAXINAL;PR
OI;25/08/2009;41034775;GUALTER FARIAS NEGRAO C E PE E FUND MED;CRUZMALTINA;PR
OI;26/10/2009;41034953;MANOEL DA NOBREGA E M PE ED INF E FUND;CRUZMALTINA;PR
OI;30/12/2009;41034961;MARIA M JAROSKIEVICZ C E PROFA E F M;FAXINAL;PR
OI;09/08/2011;41035046;OLAVO BILAC C E E FUND MEDIO;FAXINAL;PR
OI;30/12/2008;41035186;TANCREDO NEVES E M ED INF ENS FUND;FAXINAL;PR
OI;30/12/2008;41035224;ABRAHAM LINCOLN C E E FUND MEDIO;KALORE;PR
OI;25/02/2016;41035232;ALVORADA DA INFANCIA C E C EF M;KALORE;PR
OI;30/12/2008;41035240;ANGELO IMPOSSETTO E M E FUND;KALORE;PR
OI;30/12/2008;41035585;MARUMBI C E E FUND MED NOR;MARUMBI;PR
OI;30/07/2011;41035674;CARMELA DUTRA E M E I E F;RIO BOM;PR
OI;30/12/2008;41035801;REBOUCAS C E DR E FUND MEDIO;RIO BOM;PR
OI;30/12/2009;41035968;ARY B CARNEIRO C E E FUND E MEDIO;CANDIDO DE ABREU;PR
OI;30/12/2008;41036085;CANDIDO DE ABREU C E DR E F M N PROF;CANDIDO DE ABREU;PR
OI;30/12/2009;41036131;CECILIA SAWCZUK E M E FUND;CANDIDO DE ABREU;PR
OI;30/12/2009;41036190;ELIO M DE O VIEIRA E M VER E FUND;CANDIDO DE ABREU;PR
OI;03/09/2009;41036778;COSTA E SILVA E M PRES E FUND;GODOY MOREIRA;PR
OI;13/03/2009;41036824;GODOY MOREIRA C E E FUND MEDIO;GODOY MOREIRA;PR
OI;29/07/2011;41036956;FLORIANO PEIXOTO C E MAL E FUND MEDIO;GRANDES RIOS;PR
OI;30/12/2008;41037006;GEREMIAS LUNARDELLI C E COM E FUND MED;GRANDES RIOS;PR
OI;29/07/2011;41037030;ISABEL E M PRINCESA E FUND;GRANDES RIOS;PR
OI;30/12/2008;41037103;MANOEL JOSE LOPES E M ED INF ENS FUND;GRANDES RIOS;PR
OI;07/09/2009;41037219;PEDRO II E M DOM E FUND;RIO BRANCO DO IVAI;PR
OI;27/08/2008;41037235;RIO BRANCO C E E FUND MEDIO;RIO BRANCO DO IVAI;PR
OI;30/12/2008;41037324;ANTONIO DINIZ PEREIRA C E E FUND MED;IVAIPORA;PR
OI;01/09/2010;41037340;ARAPUA C E DE E FUND MEDIO;ARAPUA;PR
OI;10/11/2009;41037359;ARDINAL RIBAS E M E FUND;ARAPUA;PR
OI;30/12/2008;41037383;BARBOSA FERRAZ C E E MED NORMAL PROF;IVAIPORA;PR
OI;30/12/2008;41037413;BENTO MOSSURUNGA C E E FUND MED;IVAIPORA;PR
OI;30/12/2008;41037421;BENTO VIANA E M ED INF ENS FUND;IVAIPORA;PR
OI;30/12/2008;41037464;CARLOS LACERDA E M ED INF ENS FUND;IVAIPORA;PR
OI;30/12/2008;41037510;CERRO AZUL C E BARAO DO E FUND MEDIO;IVAIPORA;PR
OI;30/12/2008;41037650;IDALIA ROCHA C E E FUND MEDIO;IVAIPORA;PR
OI;30/12/2008;41037669;IGNES DE SOUZA CAETANO E M ED INF E FUN;IVAIPORA;PR
OI;01/01/2010;41037766;KENNEDY C E PRES E FUND MEDIO;ARIRANHA DO IVAI;PR
OI;30/12/2008;41037774;LEILA DINIZ E M ED INF ENS FUND;IVAIPORA;PR
OI;30/12/2008;41037847;MARIA D RIBEIRO PROENCA E M E I E F;IVAIPORA;PR
OI;06/09/2011;41037898;NILO PECANHA C E E FUND MEDIO;IVAIPORA;PR
OI;30/09/2013;41037952;PEDRO VIRIATO PARIGOT SOUZA E R M E F;ARAPUA;PR
OI;30/09/2013;41037995;ROMEOPOLIS E E E FUND;ARAPUA;PR
OI;30/12/2008;41038100;ANITA GARIBALDI C E ENS FUND MED;JARDIM ALEGRE;PR
OI;30/12/2008;41038150;CRISTOVAO COLOMBO C E E MEDIO NORMAL;JARDIM ALEGRE;PR
OI;30/12/2008;41038169;DILSON TEIXEIRA COELHO E M PROF E FUND;JARDIM ALEGRE;PR
OI;30/12/2009;41038185;EMILIO RIBAS E M E FUND;JARDIM ALEGRE;PR
