OI;30/12/2008;41038487;MARIA JOSE DE A MOURA E M E FUND;LIDIANOPOLIS;PR
OI;30/12/2008;41038525;PEDRO I C E DOM E FUND MEDIO;LIDIANOPOLIS;PR
OI;30/12/2008;41038665;GEREMIA LUNARDELLI C E E FUND MED NOR;LUNARDELLI;PR
OI;30/12/2008;41038746;LUNARDELLI E M DE E FUND;LUNARDELLI;PR
OI;30/12/2009;41040317;JOSE DE MATTOS LEAO C E E FUND MEDIO;SAO JOAO DO IVAI;PR
OI;30/12/2009;41040325;JOVITA CRUZ E M E FUND;SAO JOAO DO IVAI;PR
OI;04/10/2011;41040392;MONTEIRO LOBATO E M ED INF ENS FUND;SAO JOAO DO IVAI;PR
OI;26/04/2012;41040414;NEREU RAMOS E M DR ED INF ENS FUND;SAO JOAO DO IVAI;PR
OI;30/12/2009;41040481;SANTA TERESINHA E M ED INF ENS FUND;SAO JOAO DO IVAI;PR
OI;30/12/2009;41040503;TANCREDO NEVES E M ED INF ENS FUND;SAO JOAO DO IVAI;PR
OI;30/12/2009;41040570;CARLOS SILVA C E E MEDIO PROF;SAO PEDRO DO IVAI;PR
OI;30/12/2009;41040589;CONJ HAB VIRGINIO SECO E E DO E FUND;SAO PEDRO DO IVAI;PR
OI;30/12/2009;41040597;GERTRUDES M DOMINGUES E M ED INF E FUND;SAO PEDRO DO IVAI;PR
OI;30/12/2009;41040686;ALFREDINA F GOUVEIA E M PROFA E INF FUN;SAO PEDRO DO IVAI;PR
OI;30/12/2009;41040694;VICENTE MACHADO C E E FUND MEDIO;SAO PEDRO DO IVAI;PR
OI;30/12/2008;41040732;MARIA M TSUBOI E M PROFA ED INF E FUND;ASSAI;PR
OI;30/12/2009;41040740;AUGUSTA G ROCHA E M PROF ED INF E FUND;ASSAI;PR
OI;30/12/2008;41040759;CARRAO C E CONS E FUND MED PROF;ASSAI;PR
OI;30/12/2009;41040821;IZABEL E M PRINCESA ED INF ENS FUND;ASSAI;PR
OI;30/12/2008;41040872;MARIA JOSE S SANTOS E M PFA E INF E FUND;ASSAI;PR
OI;30/12/2008;41040929;RIO BRANCO C E BR DO E FUND MED PROF;ASSAI;PR
OI;30/12/2008;41040937;ROTARY CLUB E M ED INF ENS FUND;ASSAI;PR
OI;30/12/2008;41041003;ADELIA A LOPES C E PROFA E FUND MEDIO;JATAIZINHO;PR
OI;30/12/2008;41041135;PEDRO V P DE SOUZA C E PROF E FUND MED;JATAIZINHO;PR
OI;01/03/2011;41041208;VICENTE R MONTEIRO E M PROF E I E F;JATAIZINHO;PR
OI;30/12/2009;41041216;WILSON CHAMILETE E M ED INF E FUND;JATAIZINHO;PR
OI;30/12/2008;41041232;ANTONIO C GOMES C E E FUND MEDIO;NOVA SANTA BARBARA;PR
OI;01/03/2011;41041283;EDSON GONCALVES PALHANO E M E INF E FUN;NOVA SANTA BARBARA;PR
OI;30/12/2008;41041364;PAULINA PACIFICO BORSARI C E E F M NOR;RANCHO ALEGRE;PR
;30/12/2008;41041399;CICERO B RODRIGUES E M ED INF E FUND;SANTA CECILIA DO PAVAO;PR
OI;30/12/2008;41041410;JERONIMO F MARTINS C E E FUND MEDIO;SANTA CECILIA DO PAVAO;PR
OI;30/12/2009;41042042;EUFROSINA R SILVA E M ED INF ENS FUND;;PR
OI;30/12/2008;41042077;JERONIMO ONUMA C E PE E MEDIO;SAO SEBASTIAO DA AMOREIRA;PR
OI;30/12/2009;41042085;JOAO TURIN C E ENS FUND MED;SAO SEBASTIAO DA AMOREIRA;PR
OI;13/09/2011;41042174;ANNE MARIE KONRAD E M ENS FUND;URAI;PR
OI;30/12/2009;41042263;JOAO R JUNIOR E M DR E FUND;URAI;PR
OI;30/12/2009;41042280;LEONIDAS PONTES E M E FUND;URAI;PR
OI;30/12/2009;41042336;PAULO MOZART MACHADO E E PROF E FUND;URAI;PR
OI;30/12/2008;41042344;REGINA TOKANO C E PROFA E MEDIO;URAI;PR
OI;21/09/2011;41042352;RUBENS L FILGUEIRAS C E E FUND MEDIO;URAI;PR
OI;30/12/2009;41042476;AFRANIO PEIXOTO E E E FUND;ABATIA;PR
OI;30/12/2009;41042590;BOSCO E M DOM EDUC INF E FUND;ABATIA;PR
OI;30/12/2008;41042670;RUI BARBOSA C E E MEDIO;ABATIA;PR
OI;30/12/2009;41042735;ANA NERY E M ED INF ENS FUND;ANDIRA;PR
OI;30/12/2008;41042760;BARBOSA FERRAZ C E E FUND MEDIO;ANDIRA;PR
OI;30/12/2008;41042778;STELLA MARIS C E E FUND MEDIO PROF;ANDIRA;PR
OI;30/12/2008;41042786;CRIANCA FELIZ E M ED INF ENS FUND;ANDIRA;PR
OI;30/12/2008;41042794;DURVAL RAMOS FILHO C E E FUND MED NORM;ANDIRA;PR
OI;30/12/2008;41042824;MICHEL KAIRALLA E M PROF ED INF E FUND;ANDIRA;PR
OI;30/12/2009;41042840;PINGO DE GENTE E M ED INF ENS FUND;ANDIRA;PR
OI;30/12/2009;41042859;SANTA INES E M ED INF ENS FUND;ANDIRA;PR
OI;30/12/2009;41042875;BAIRRO BELA VISTA E E DO E FUND;BANDEIRANTES;PR
OI;30/12/2009;41042905;CECILIA MEIRELES E E E FUND;BANDEIRANTES;PR
OI;30/12/2008;41042956;CYRIACO RUSSO C E E MEDIO NORMAL;BANDEIRANTES;PR
OI;30/12/2009;41042980;DIOGENES E P VASCONCELOS E M E INF E F;BANDEIRANTES;PR
OI;30/12/2009;41043111;HUBERTO TEIXEIRA RIBEIRO C E E F MED;BANDEIRANTES;PR
OI;30/12/2008;41043200;JUVENAL MESQUITA C E E FUND MEDIO;BANDEIRANTES;PR
OI;30/12/2009;41043235;LEDA DE L CANARIO E M ED INF ENS FUND;BANDEIRANTES;PR
OI;30/12/2008;41043286;MAILON MEDEIROS C E PROF EF MED PROF;BANDEIRANTES;PR
OI;30/12/2009;41043324;MARIA DE LOURDES G MENDES E M E INF E F;BANDEIRANTES;PR
OI;30/12/2009;41043332;MARIA INES SPEER FARIA E M E INF E FUND;BANDEIRANTES;PR
OI;30/12/2009;41043359;MOACYR CASTANHO E M PREF E INF E FUND;BANDEIRANTES;PR
OI;30/12/2009;41043375;NOBREGA DA CUNHA C E E FUND MEDIO;BANDEIRANTES;PR
OI;30/12/2008;41129962;;CURITIBA;PR
OI;30/12/2008;41129970;IVO LEAO C E E FUND MEDIO;CURITIBA;PR
OI;30/12/2008;41129989;IVO ZANLORENZI E E MONSENHOR E FUND;CURITIBA;PR
OI;30/12/2008;41129997;;CURITIBA;PR
OI;30/12/2009;41130006;;CURITIBA;PR
OI;30/12/2008;41130022;ESCOLA MUNICIPAL JARDIM EUROPA - EDU;CURITIBA;PR
OI;30/12/2009;41130030;ESCOLA MUNICIPAL JARDIM SANTO INACIO-;CURITIBA;PR
OI;30/12/2008;41130049;ESCOLA MUNICIPAL JARDIM SANTOS ANDRADE;CURITIBA;PR
OI;30/12/2008;41130057;SAO PEDRO APOSTOLO C E E FUND MED PROF;CURITIBA;PR
OI;30/12/2008;41130065;JAYME CANET C E E FUND MEDIO;CURITIBA;PR
OI;30/12/2008;41130103;JOAO BETTEGA C E E FUND MEDIO;CURITIBA;PR
OI;30/12/2008;41130111;ESCOLA MUNICIPAL PADRE JOAO CRUCIANI;CURITIBA;PR
OI;30/12/2008;41130138;JOAO DE OLIVEIRA FRANCO C E E FUND MED;CURITIBA;PR
OI;30/12/2008;41130146;JOAO LOYOLA C E PROF E FUND MEDIO;CURITIBA;PR
OI;30/12/2008;41130154;ESCOLA MUNICIPAL PROFESSOR JOAO MACEDO FILHO;CURITIBA;PR
OI;30/12/2008;41130162;JOAO MAZZAROTTO C E E FUND E MEDIO;CURITIBA;PR
OI;30/12/2008;41130170;JOAO PAULO I C E PAPA E FUND MEDIO;CURITIBA;PR
OI;30/12/2008;41130189;JOAO PAULO II C E E FUND MEDIO;CURITIBA;PR
OI;30/12/2008;41130197;JOAO TURIN C E E FUND MEDIO;CURITIBA;PR
OI;01/01/2011;41130200;JOAO WISLINSKI E E PE E FUND;CURITIBA;PR
OI;30/12/2008;41130219;ESCOLA MUNICIPAL PAPA JOAO XXIII;CURITIBA;PR
OI;30/12/2008;41130235;ESCOLA MUNICIPAL JOAQUIM TAVORA - ENSINO FUN;CURITIBA;PR
OI;30/12/2008;41130243;JOSE BUSNARDO C E E FUND MEDIO;CURITIBA;PR
OI;30/12/2008;41130251;ESCOLA MUNICIPAL CEI PROFESSOR JOSE CAVALLIN;CURITIBA;PR
OI;30/12/2008;41130260;ESCOLA MUNICIPAL PADRE JOSE DE ANCHIETA;CURITIBA;PR
OI;30/12/2008;41130294;JOSE FRESSATO C E E FUND MEDIO;CURITIBA;PR
OI;30/12/2008;41130308;JOSE GUIMARAES C E PROF E MEDIO PROF;CURITIBA;PR
OI;30/12/2008;41130316;;CURITIBA;PR
OI;30/12/2009;41130324;ESCOLA MUNICIPAL CEI PROFESSOR;CURITIBA;PR
OI;30/12/2008;41130332;;CURITIBA;PR
OI;30/12/2008;41130340;JULIA WANDERLEY C E E FUND MEDIO PROF;CURITIBA;PR
OI;30/12/2008;41130359;JULIO MESQUITA C E PROF E F M PROF;CURITIBA;PR
OI;30/12/2009;41130367;ESCOLA MUNICIPAL CEI JULIO MOREIRA - ENSINO FUNDAMENTAL;;PR
OI;30/12/2008;41130383;;;PR
OI;30/12/2008;41130405;LA SALLE C E E FUND MED;CURITIBA;PR
OI;30/12/2008;41130413;;;PR
OI;30/12/2008;41130421;LAMENHA LINS C E PRES ENS MED PROF;CURITIBA;PR
OI;30/12/2008;41130430;;CURITIBA;PR
OI;30/12/2009;41130480;;CURITIBA;PR
OI;30/12/2008;41130499;LEONCIO CORREIA C E E F MEDIO E PROF;CURITIBA;PR
OI;30/12/2008;41130502;;CURITIBA;PR
OI;30/12/2009;41130529;;CURITIBA;PR
OI;30/12/2008;41130553;;CURITIBA;PR
OI;30/12/2008;41130570;;CURITIBA;PR
OI;30/12/2008;41130618;LOUREIRO FERNANDES C E PROF E F MED PRO;CURITIBA;PR
OI;30/12/2008;41130634;LUCIA BASTOS COL EST ENS FUN E MEDIO;CURITIBA;PR
OI;30/12/2008;41130669;LUIZ CARLOS DE P E SOUZA C E P EF MPR;CURITIBA;PR
OI;22/04/2015;41130677;LUIZ LOSSO FILHO CEEBJA DR EF M;CURITIBA;PR
OI;30/12/2008;41130685;LUIZA ROSS C E PROFA E FUND MEDIO;CURITIBA;PR
OI;30/12/2008;41130693;ESCOLA MUNICIPAL DONA LULA;CURITIBA;PR
OI;30/12/2008;41130723;LYSIMACO F COSTA C E PROF E FUND MEDIO;CURITIBA;PR
OI;30/12/2008;41130782;MANOEL A GUIMARAES C E SEN E FUND MED;CURITIBA;PR
OI;30/12/2008;41130790;MANOEL RIBAS C E E FUND MEDIO;CURITIBA;PR
OI;30/12/2008;41130804;ESCOLA MUNICIPAL MANSUR GUERIOS;CURITIBA;PR
OI;30/12/2008;41130812;ESCOLA MUNICIPAL DOM MANUEL DA SIL;CURITIBA;PR
OI;30/12/2008;41130820;ESCOLA MUNICIPAL DESEMBARGADOR M;CURITIBA;PR
OI;30/12/2008;41130839;ESCOLA MUNICIPAL CEI PROFESSORA MARIA;CURITIBA;PR
OI;30/12/2008;41130847;MARIA A TEIXEIRA C E PF E FUND MED PROF;CURITIBA;PR
OI;30/12/2008;41130855;MARIA BALBINA COSTA DIAS C E PROFA EF EM;CURITIBA;PR
OI;30/12/2008;41130863;ESCOLA MUNICIPAL MARIA CLARA BRANDAO TESSEROLLI ;CURITIBA;PR
OI;30/12/2008;41130871;ESCOLA MUNICIPAL MARIA DO CARMO MARTINS;CURITIBA;PR
OI;30/12/2008;41130880;ESCOLA MUNICIPAL MADRE MARIA DOS ANJOS;CURITIBA;PR
OI;30/12/2009;41130901;MARIA GAI GRENDEL C E PROFA E FUND MED;CURITIBA;PR
OI;30/12/2008;41130910;MARIA HELOISA CASSELLI E E PROFA E FUND;CURITIBA;PR
OI;30/12/2008;41130936;MARIA MONTESSORI C E E FUND MEDIO;CURITIBA;PR
OI;30/12/2009;41130944;ESCOLA MUNICIPAL PROFESSORA MARIA NICOLAS;CURITIBA;PR
OI;30/12/2008;41130952;MARIA P MARTINS E E E FUND;CURITIBA;PR
OI;30/12/2008;41130979;ESCOLA MUNICIPAL MARINGA - ENSINO FUNDAMENTAL;CURITIBA;PR
OI;30/12/2008;41131002;MAXIMO ATILIO ASINELLI C E PROF E F M;CURITIBA;PR
OI;30/12/2008;41131193;ESCOLA MUNICIPAL MIGUEL KRUG;CURITIBA;PR
OI;30/12/2008;41131223;MILTON CARNEIRO C E E FUND MEDIO;CURITIBA;PR
OI;30/12/2008;41131274;;CURITIBA;PR
OI;30/12/2008;41131282;;CURITIBA;PR
OI;30/12/2008;41131312;;CURITIBA;PR
OI;30/12/2008;41131347;;CURITIBA;PR
OI;30/12/2008;41131452;;CURITIBA;PR
OI;30/12/2008;41131460;NARCISO MENDES C E PROF E FUND MEDIO;CURITIBA;PR
OI;30/12/2008;41131479;NATALIA REGINATO C E E FUND MEDIO PROF;CURITIBA;PR
OI;30/12/2008;41131495;NEWTON F DA COSTA C E E FUND MED;CURITIBA;PR
OI;30/12/2008;41131517;NILO BRANDAO C E PROF E FUND MEDIO;CURITIBA;PR
OI;30/12/2008;41131525;NILSON BAPTISTA RIBAS C E E FUND MED;CURITIBA;PR
OI;30/12/2008;41131533;ESCOLA MUNICIPAL NIVALDO BRAGA;CURITIBA;PR
OI;30/12/2008;41131576;NOSSA SRA APARECIDA C E E FUND MEDIO;CURITIBA;PR
OI;30/12/2008;41131592;NOSSA SRA DA SALETE E E E FUND;CURITIBA;PR
OI;30/12/2008;41131614;NOSSA SRA DE FATIMA E E E FUND;CURITIBA;PR
OI;30/12/2008;41131649;;CURITIBA;PR
OI;30/12/2008;41131681;;CURITIBA;PR
OI;30/12/2008;41131762;;CURITIBA;PR
OI;30/12/2009;41131819;;CURITIBA;PR
OI;30/12/2008;41131886;OLAVO DEL CLARO C E PROF E FUND MED;CURITIBA;PR
OI;30/12/2008;41131894;OLIMPIO DE SOUZA C E PE E FUND MEDIO;CURITIBA;PR
OI;30/12/2008;41131908;OLIVIO BELICH C E DEP E FUND MEDIO;CURITIBA;PR
OI;30/12/2008;41131916;ESCOLA MUNICIPAL CEI OLIVIO SOARES SABOIA;CURITIBA;PR
OI;30/12/2009;41131924;ESCOLA MUNICIPAL PREFEITO OMAR SABBAG;CURITIBA;PR
OI;30/12/2008;41131967;ORIONE E E DOM E FUND;CURITIBA;PR
OI;30/12/2008;41132050;ESCOLA MUNICIPAL DOUTOR OSVALDO CRUZ -ENSINO FUNDAMENTAL;;PR
OI;30/12/2008;41132122;PARANA C E DO ENS FUND MED PROFIS;CURITIBA;PR
OI;;41132149;ESCOLA MUNICIPAL PARANAGUA - ENSINO FUNDAMENTAL;CURITIBA;PR
OI;;41132157;ESCOLA MUNICIPAL PARANAVAI - EDUCACAO INFANTI;;PR
OI;;41132203;PAULA GOMES C E E FUND MEDIO;CURITIBA;PR
OI;30/12/2008;41132211;PAULINA P BORSARI C E E FUND MEDIO;CURITIBA;PR
OI;30/12/2008;41132220;PAULO LEMINSKI C E E FUND MED NOR PROF;CURITIBA;PR
OI;30/12/2008;41132238;ESCOLA MUNICIPAL PAULO ROGERIO GUIMARAES ESMANHOTO;;PR
OI;30/12/2008;41132289;;;PR
OI;30/12/2008;41132297;PEDRO II E E DOM E FUND;CURITIBA;PR
OI;30/12/2008;41132300;PEDRO MACEDO C E E FUND MEDIO PROF;CURITIBA;PR
OI;30/12/2008;41132319;;;PR
OI;30/12/2008;41132475;PINHEIRO DO PARANA C E E FUND MED PROF;CURITIBA;PR
OI;30/12/2008;41132483;PIO LANTERI C E E FUND MEDIO;CURITIBA;PR
OI;30/12/2008;41132513;;CURITIBA;PR
OI;30/12/2008;41132556;POL MILITAR C CEL P M F S MIR E F MED;CURITIBA;PR
OI;30/12/2008;41132572;POLIVALENTE DE CURITIBA C E E FUN MED;CURITIBA;PR
OI;30/12/2008;41132637;PRIETO MARTINEZ C E E FUND MEDIO;CURITIBA;PR
OI;;41132696;ESCOLA MUNICIPAL PRO-MORAR BARIGUI;CURITIBA;PR
OI;;41132718;PROTASIO DE CARVALHO C E E FUND MEDIO;CURITIBA;PR
OI;;41132734;ESCOLA MUNICIPAL CEI RAOUL WALLENBER;CURITIBA;PR
OI;;41132750;ESCOLA MUNICIPAL RAUL GELBECK;CURITIBA;PR
OI;30/12/2008;41132882;REPUBLICA ORIENTAL DO URUGUAI E E E F;CURITIBA;PR
OI;30/12/2008;41132904;ESCOLA MUNICIPAL PROFESSOR RICARDO KRIEGER;CURITIBA;PR
OI;30/12/2008;41132912;RIO BRANCO C E E MEDIO PROF;CURITIBA;PR
OI;30/12/2008;41132920;RIO BRANCO C E BAR DO ENS FUND MED;CURITIBA;PR
OI;30/12/2008;41132939;ESCOLA MUNICIPAL RIO NEGR;CURITIBA;PR
OI;30/12/2008;41132947;;CURITIBA;PR
OI;30/12/2008;41132955;ROBERTO LANGER JUNIOR C E E FUND MEDIO;CURITIBA;PR
OI;30/12/2008;41132980;ESCOLA MUNICIPAL ROLANDIA - ENSINO FUNDAMENTAL;CURITIBA;PR
OI;30/12/2008;41132998;;CURITIBA;PR
OI;30/12/2008;41133030;;CURITIBA;PR
OI;30/12/2008;41133099;;CURITIBA;PR
OI;30/12/2008;41133102;SANTA CANDIDA C E E FUND MEDIO PROF;CURITIBA;PR
OI;30/12/2009;41133137;SANTA FELICIDADE C E E FUND MEDIO;CURITIBA;PR
OI;30/12/2008;41133145;SANTA GEMMA GALGANI C E E FUND MEDIO;CURITIBA;PR
OI;30/12/2008;41133161;SANTA ROSA C E E FUND MEDIO;CURITIBA;PR
OI;30/12/2008;41133188;SANTO AGOSTINHO C E E FUND MEDIO;CURITIBA;PR
OI;30/12/2008;41133200;SANTO ANTONIO E E E FUND;CURITIBA;PR
OI;30/12/2008;41133226;SANTOS DUMONT C E E FUND MEDIO PROF;CURITIBA;PR
OI;30/12/2008;41133234;SAO BRAZ C E E FUND E MEDIO;CURITIBA;PR
OI;30/12/2008;41133250;SAO FRANCISCO DE ASSIS E E E FUND;CURITIBA;PR
OI;30/12/2008;41133323;ESCOLA MUNICIPAL SAO LUIZ - EDUCACAO INFANTIL;CURITIBA;PR
OI;30/12/2008;41133331;ESCOLA MUNICIPAL SAO MATEUS DO SUL - EDUCACAO INFANTIL;;PR
OI;30/12/2008;41133340;ESCOLA MUNICIPAL SAO MIGUEL - ENSINO FUNDAMENTAL;CURITIBA;PR
OI;30/12/2009;41133358;SAO PAULO APOSTOLO C E E FUND MEDIO;CURITIBA;PR
OI;01/04/2011;41133366;SAO SEBASTIAO E E E FUND;CURITIBA;PR
OI;30/12/2008;41133404;SEBASTIAO SAPORSKI C E E FUND MEDIO;CURITIBA;PR
OI;30/12/2008;41133412;SEGISMUNDO FALARZ C E E FUND MEDIO;CURITIBA;PR
OI;30/12/2008;41133471;SENHORINHA M SARMENTO C E E FUND MED;CURITIBA;PR
;30/12/2008;41133552;ESCOLA MUNICIPAL SIDONIO MURALHA - EDUCACAO INFANTI;CURITIBA;PR
OI;30/12/2008;41133560;SILVESTRE KANDORA C E PE E FUND MED PRO;CURITIBA;PR
OI;30/12/2008;41133650;;CURITIBA;PR
OI;30/12/2008;41133668;;CURITIBA;PR
OI;30/12/2008;41133749;;CURITIBA;PR
OI;30/12/2008;41133757;INSTITUTO FEDERAL DO PARANA - CAMPUS CURITIBA;CURITIBA;PR
OI;30/12/2008;41133781;TEOTONIO VILELA C E E FUND MED;CURITIBA;PR
OI;30/12/2008;41133811;;CURITIBA;PR
OI;01/12/2010;41133854;;CURITIBA;PR
OI;30/12/2008;41134028;TIRADENTES C E E FUND MEDIO;CURITIBA;PR
OI;30/12/2008;41134168;;CURITIBA;PR
OI;30/12/2008;41134176;;CURITIBA;PR
OI;30/12/2008;41134214;ESCOLA MUNICIPAL UMUARAMA - ENSINO FUNDAMENTAL;CURITIBA;PR
OI;30/12/2008;41134273;VICTOR DO AMARAL C E PROF E F M PROF;CURITIBA;PR
OI;30/12/2008;41134290;;;PR
OI;30/12/2009;41134389;;CURITIBA;PR
;30/12/2008;41134397;;CURITIBA;PR
OI;30/12/2008;41134419;;CURITIBA;PR
OI;30/12/2008;41134435;YVONE PIMENTEL C E E FUND MEDIO;CURITIBA;PR
OI;30/12/2008;41134443;ZACARIAS C E CONS E FUND MEDIO;CURITIBA;PR
OI;30/12/2008;41134460;ANITA CANET C E E FUND MEDIO PROF;FAZENDA RIO GRANDE;PR
OI;30/12/2008;41134478;ANTONIO BALDAN E M ED INF ENS FUND;FAZENDA RIO GRANDE;PR
OI;30/12/2008;41134486;ARNALDO BUSATO E M ED INF ENS FUND;FAZENDA RIO GRANDE;PR
OI;30/12/2009;41134494;BAYARD OSNA C E DR E FUND MEDIO;FAZENDA RIO GRANDE;PR
OI;30/12/2009;41134508;CARLOS EDUARDO NICHELE E M E INF E FUND;FAZENDA RIO GRANDE;PR
OI;30/12/2008;41134516;DECIO DOSSI C E DR E FUND MEDIO PROF;FAZENDA RIO GRANDE;PR
OI;30/12/2008;41134532;GUISELA KUSS RIEKE E M ED INF E FUND;FAZENDA RIO GRANDE;PR
;30/12/2008;41134559;DEP LUIZ G SAMPAIO E M DEP ED INF E FUND;FAZENDA RIO GRANDE;PR
OI;30/12/2008;41134567;MARLENE BARBOSA E M ED INF ENS FUND;FAZENDA RIO GRANDE;PR
OI;30/12/2008;41134605;JORGE ANDRIGUETTO C E DES E F M P N;FAZENDA RIO GRANDE;PR
OI;30/12/2008;41134613;SANTA FE E M ED INF ENS FUND;FAZENDA RIO GRANDE;PR
;30/12/2008;41134630;SAO FRANCISCO DE ASSIS E M ED INF E FUND;FAZENDA RIO GRANDE;PR
OI;30/12/2008;41134648;SAO GABRIEL E M ED INF ENS FUND;FAZENDA RIO GRANDE;PR
OI;30/12/2008;41134664;VINTE E SEIS DE JANEIRO E M E INF E FUN;FAZENDA RIO GRANDE;PR
OI;30/12/2009;41134710;ANTONIO ALVES E E BEL E FUND;ITAPERUCU;PR
OI;30/12/2009;41134729;BARNABE TENANI E M FREI ED INF E FUND;ITAPERUCU;PR
OI;30/12/2009;41134788;CANDIDOS E M DE E FUND;ITAPERUCU;PR
OI;30/12/2009;41135091;ALICE MACHADO FERREIRA E M E FUND;MANDIRITUBA;PR
OI;30/12/2009;41135164;BOM JESUS E M ED INF ENS FUND;MANDIRITUBA;PR
OI;01/09/2010;41135270;JOAO A DE CAMARGO C E E FUND MEDIO;MANDIRITUBA;PR
OI;30/12/2009;41135334;JOAQUIM DE O FRANCO C E E FUND MEDIO;MANDIRITUBA;PR
OI;30/12/2009;41135555;VITOR LEAL CLAUDINO E M ED INF E FUND;MANDIRITUBA;PR
OI;30/12/2008;41135580;AMYNTAS DE BARROS C E E F M PROF;PINHAIS;PR
OI;30/12/2009;41135598;ANTONIO ALCEU ZIELONKA E M E I E FUND;PINHAIS;PR
OI;30/12/2008;41135601;ANTONIO ANDRADE E M ED INF ENS FUND;PINHAIS;PR
OI;30/12/2008;41135610;ARNALDO F BUSATO C E DEP E F MED NOR PRO;PINHAIS;PR
OI;30/12/2008;41135628;AROLDO DE FREITAS E M ED INF ENS FUND;PINHAIS;PR
OI;30/12/2008;41135636;CHAFIC SMAKA E M ED INF ENS FUND;PINHAIS;PR
OI;30/12/2009;41135644;CLEMENTINA CRUZ E M ED INF ENS FUND;PINHAIS;PR
OI;30/12/2009;41135679;EGIDIO CARLOTO E M FREI E INF E FUND;PINHAIS;PR
OI;30/12/2009;41135687;FELIPE ZENI E M ED INF ENS FUND;PINHAIS;PR
OI;30/12/2009;41135695;GUILHERME CEOLIN E M E FUND;PINHAIS;PR
OI;30/12/2009;41135709;HUMBERTO A CASTELO BRANCO C E E FUND MED;PINHAIS;PR
OI;30/12/2008;41135717;PAULO FREIRE C E PROF E FUND MED;PINHAIS;PR
OI;30/12/2009;41135725;JOAO LEAL E M ENS FUND;PINHAIS;PR
OI;30/12/2008;41135733;JOAO LEOPOLDO JACOMEL E M E INF FUND;PINHAIS;PR
OI;30/12/2008;41135750;JOSE BRUNETTI GUGELMIN E M E I E FUND;PINHAIS;PR
OI;30/12/2008;41135784;LEOCADIA B RAMOS C E E FUND MED PROF;PINHAIS;PR
OI;30/12/2009;41135792;LIRIO JACOMEL E M ED INF ENS FUND;PINHAIS;PR
OI;30/12/2009;41135806;MARIA CAPPELLARI E M E INF ENS FUND;PINHAIS;PR
OI;30/12/2009;41135814;MARIA CHALCOSKI E M DONA E I E F;PINHAIS;PR
OI;30/12/2008;41135822;MARINS DE SOUZA SANTOS E M E I E F;PINHAIS;PR
OI;30/12/2008;41135830;MATHIAS JACOMEL C E E FUND MEDIO;PINHAIS;PR
OI;30/12/2008;41135857;ODILE CHARLOTTE BRUINJE E M E I E FUN;PINHAIS;PR
OI;30/12/2008;41135911;SEMIRAMIS DE B BRAGA C E E FUND MEDIO;PINHAIS;PR
OI;30/12/2008;41135920;SEVERINO MASSIGNAN E M ED INF E FUND;PINHAIS;PR
OI;30/12/2008;41135938;SPRENGER C E TEN E FUND MEDIO;PINHAIS;PR
OI;30/12/2008;41135954;THEREZA C MACHADO E M PROFA E I E F;PINHAIS;PR
OI;30/12/2009;41135962;31 DE MARCO E M ED INF FUND;PINHAIS;PR
OI;30/12/2008;41135970;OTTILIA H DA SILVA C E PROF E FUND MED;PINHAIS;PR
OI;30/12/2008;41136004;ANTONIO SCARANTE E M E FUND;PIRAQUARA;PR
OI;30/12/2009;41136276;VILA MACEDO C E E FUND MEDIO E PROF;PIRAQUARA;PR
OI;30/12/2009;41136292;ANDRE ANDREATTA C E E FUND MEDIO;QUATRO BARRAS;PR
OI;30/12/2009;41136306;ARLINDA F CREPLIVE C E E FUND MED PROF;QUATRO BARRAS;PR
OI;30/12/2009;41136322;DEVANIRA F ALVES E M ED INF ENS FUND;QUATRO BARRAS;PR
OI;01/12/2010;41136330;ERNESTO MILANI E M E FUND;QUATRO BARRAS;PR
OI;30/12/2009;41136357;IZAIR LAGO E M E FUND;QUATRO BARRAS;PR
OI;30/12/2008;41136365;JOAO C DA SILVA E M E INF E FUND;QUATRO BARRAS;PR
OI;30/12/2009;41136535;BENJAMIN CONSTANT E M ED INF ENS FUND;RIO BRANCO DO SUL;PR
OI;30/12/2009;41136705;HILDA FARIA FRANCO E E PROFA E FUND;RIO BRANCO DO SUL;PR
OI;30/12/2009;41136802;JOSE R CRISTO E M PROF ED INF E FUND;RIO BRANCO DO SUL;PR
OI;30/12/2009;41136829;MANOEL B DE MACEDO C E PROF E FUND MED;RIO BRANCO DO SUL;PR
OI;30/12/2009;41136845;MARIA DA LUZ FURQUIM C E E FUND MED NOR;RIO BRANCO DO SUL;PR
OI;30/12/2009;41136853;MARIA DA LUZ C LIMA E M ED INF E FUND;RIO BRANCO DO SUL;PR
OI;01/03/2011;41136861;MARIA ELISA CRUZ E M PROFA E INF FUND;RIO BRANCO DO SUL;PR
OI;30/12/2009;41136896;NILCE FARIAS ELIAS E M E FUND;RIO BRANCO DO SUL;PR
OI;30/12/2009;41136900;OCTAVIO FURQUIM E M PREF ED INF E FUND;RIO BRANCO DO SUL;PR
OI;30/12/2009;41137191;VICTOR DE O FRANCO E M E FUND;RIO BRANCO DO SUL;PR
OI;30/12/2009;41137213;VOVO BRASILIA E M ED INF ENS FUND;RIO BRANCO DO SUL;PR
OI;30/12/2008;41137230;AFONSO PENA C E E FUND MEDIO;SAO JOSE DOS PINHAIS;PR
OI;30/12/2009;41137248;ALEXANDRE LEON C BORDES E M E I E F;SAO JOSE DOS PINHAIS;PR
OI;30/12/2009;41137272;ANA MARIA MORO DISSENHA E M E FUND;SAO JOSE DOS PINHAIS;PR
OI;30/12/2008;41137299;ANANIAS A MAUAD E M ED INF ENS FUND;SAO JOSE DOS PINHAIS;PR
OI;01/12/2010;41137302;ANGELINA L MACEDO E M PROFA E FUND;SAO JOSE DOS PINHAIS;PR
OI;30/12/2008;41137310;ANIBAL R LEAL E M ED INF ENS FUND;SAO JOSE DOS PINHAIS;PR
OI;01/06/2010;41137329;ANITA CANET C E E FUND MEDIO;SAO JOSE DOS PINHAIS;PR
OI;30/12/2009;41137337;ANTONIO F DA ROCHA E M E FUND;SAO JOSE DOS PINHAIS;PR
OI;30/12/2008;41137345;ANTONIO NUNES DA R RIOS E M ED I E FUND;;PR
OI;01/03/2011;41137361;ARNALDO JANSEN C E PE E FUND MEDIO;SAO JOSE DOS PINHAIS;PR
OI;30/12/2009;41137477;CASTRO ALVES E M ED INF ENS FUND;SAO JOSE DOS PINHAIS;PR
OI;30/12/2008;41137485;CELESTINA S FOGGIATTO E M ED INF E FUND;;PR
OI;30/12/2008;41137493;CHICO MENDES C E E FUND MEDIO;SAO JOSE DOS PINHAIS;PR
OI;30/12/2008;41137507;CLODOALDO NAUMANN, E M - ED INF E FUND;;PR
OI;30/12/2009;41137515;LINDAURA R LUCAS C E PROF E FUND MEDIO;;PR
OI;30/12/2009;41137531;COLONIA MURICI C E DA E FUND MEDIO;SAO JOSE DOS PINHAIS;PR
OI;30/12/2008;41137540;HERBET DE SOUZA C E E FUND MED;SAO JOSE DOS PINHAIS;PR
OI;30/12/2008;41137558;COSTA VIANA C E E FUND MED PROF NORM;SAO JOSE DOS PINHAIS;PR
OI;30/12/2009;41137639;DULCE E M IRMA ED INF ENS FUND;SAO JOSE DOS PINHAIS;PR
OI;30/12/2008;41137647;ELVIRA P CARRANO E M PROFA E INF E FUND;;PR
OI;30/12/2009;41137663;ERNESTINA M DE S CORTES E M PFA E I E F;;PR
OI;30/12/2008;41137671;SAO CRISTOVAO C E E FUND MEDIO;SAO JOSE DOS PINHAIS;PR
OI;30/12/2009;41137698;MARIA VIDAL NOVAES E E E FUND;SAO JOSE DOS PINHAIS;PR
;30/12/2008;41137728;EUGENIA DA CRUZ S TALAMINI E M E I E F;SAO JOSE DOS PINHAIS;PR
OI;30/12/2008;41137736;EUNICE BORGES DA ROCHA C E E FUND MEDIO;;PR
OI;30/12/2008;41137744;EZALTINA C MEIGA E M PROFA E INF E FUND;;PR
OI;30/12/2008;41137795;GENOVEVA S DE BRITO E M PROFA E I E FUN;;PR
OI;30/12/2009;41137809;GODOFREDO MACHADO E E E FUND;SAO JOSE DOS PINHAIS;PR
OI;30/12/2008;41137841;GUATUPE C E E FUND MEDIO;SAO JOSE DOS PINHAIS;PR
OI;30/12/2008;41137868;IPE C E E FUND E MEDIO;SAO JOSE DOS PINHAIS;PR
OI;30/12/2008;41137892;JORGE NASCIMENTO E M ED INF ENS FUND;SAO JOSE DOS PINHAIS;PR
OI;30/12/2009;41137906;JOSE DE ANCHIETA E M ED INF ENS FUND;SAO JOSE DOS PINHAIS;PR
OI;30/12/2008;41137930;JUSCELINO K OLIVEIRA C E E FUND MEDIO;SAO JOSE DOS PINHAIS;PR
OI;30/12/2008;41137965;LEONILDA R TREVISAN E M E FUND;SAO JOSE DOS PINHAIS;PR
OI;30/12/2008;41137981;LOURDES BONIN E M PROFA ED INF E FUND;SAO JOSE DOS PINHAIS;PR
OI;30/12/2008;41137990;LUIZ SINGER, E M - ED INF ENS FUND;SAO JOSE DOS PINHAIS;PR
;30/12/2008;41138015;MARIA EUF TORRES E M IRMA E INF E FUND;SAO JOSE DOS PINHAIS;PR
OI;30/12/2008;41138023;MARIA R S TREVISAN E M ED INF E FUND;SAO JOSE DOS PINHAIS;PR
OI;30/12/2008;41138031;MARIO FLORES E M PROF ED INF ENS FUND;SAO JOSE DOS PINHAIS;PR
OI;30/12/2008;41138040;MARTIM AFONSO DE SOUZA E M E I E F;SAO JOSE DOS PINHAIS;PR
OI;01/12/2010;41138066;MODESTO ZANIOLO E M ED INF ENS FUND;SAO JOSE DOS PINHAIS;PR
OI;30/12/2008;41138074;NARCISO MENDES E M ED INF ENS FUND;SAO JOSE DOS PINHAIS;PR
OI;30/12/2008;41138082;NOSSA SENHORA APARECIDA E M E I E F;SAO JOSE DOS PINHAIS;PR
OI;30/12/2009;41138090;NOSSA SENHORA DOS MILAGRES E E E FUND;SAO JOSE DOS PINHAIS;PR
OI;30/12/2009;41138120;OLAVO BILAC E M ED INF ENS FUND;SAO JOSE DOS PINHAIS;PR
OI;30/12/2008;41138139;OLIVIA NOGUEIRA E M PROFA ED INF E FUND;;PR
OI;01/09/2010;41138147;PAULO PIMENTEL E M ED INF ENS FUND;SAO JOSE DOS PINHAIS;PR
OI;01/06/2010;41138155;PAULO VI E M PAPA ED INF ENS FUND;SAO JOSE DOS PINHAIS;PR
OI;30/12/2008;41138171;PEDRO BONK E M E FUND;SAO JOSE DOS PINHAIS;PR
OI;30/12/2009;41138180;PEDRO C DA ROCHA E M PROF E I E F;SAO JOSE DOS PINHAIS;PR
OI;30/12/2009;41138198;PEDRO FUSS E M PE ED INF ENS FUND;SAO JOSE DOS PINHAIS;PR
OI;30/12/2008;41138228;PEDRO MORO REDESCHI E M E FUND;SAO JOSE DOS PINHAIS;PR
OI;30/12/2008;41138287;ROSI M MARCHESINI E M ED INF ENS FUND;SAO JOSE DOS PINHAIS;PR
OI;30/12/2009;41138341;SANTA RITA E M ED INF ENS FUND;SAO JOSE DOS PINHAIS;PR
OI;30/12/2009;41138406;SAO JOSE E M ED INF ENS FUND;SAO JOSE DOS PINHAIS;PR
OI;30/12/2008;41138422;SILVEIRA DA MOTTA C E E FUND MEDIO;SAO JOSE DOS PINHAIS;PR
OI;30/12/2009;41138449;TIRADENTES C E E FUND MEDIO;SAO JOSE DOS PINHAIS;PR
OI;30/12/2008;41138457;UNIDADE POLO C E E FUND MEDIO;SAO JOSE DOS PINHAIS;PR
OI;30/12/2008;41138635;SEVERO FERREIRA RUPPEL C E E FUND MEDIO;TUNAS DO PARANA;PR
OI;30/12/2008;41138643;PROF ABGAIL CANDIDO KRASOTA E M E FUND;TUNAS DO PARANA;PR
OI;30/12/2009;41138651;ARACY PINHEIRO LIMA E M PROFA E I F;ANTONINA;PR
OI;30/12/2009;41138678;CLEUZA M DE L TAGLIATELA E M PFA E I F;ANTONINA;PR
OI;27/01/2012;41138783;HIRAM ROLIM LAMAS C E E FUND MEDIO;ANTONINA;PR
OI;01/09/2010;41138856;MARIA ARMINDA E E PROF E FUND;ANTONINA;PR
OI;29/07/2011;41138872;MIRANDA COUTO E M DR ED INF ENS FUND;ANTONINA;PR
OI;30/12/2009;41138880;MOYSES LUPION C E E FUND MED;ANTONINA;PR
OI;30/12/2009;41138902;OCTAVIO SECUNDINO E M ED INF ENS FUND;ANTONINA;PR
OI;30/12/2009;41138937;ROCHA POMBO C E E FUND MEDIO;ANTONINA;PR
OI;30/12/2009;41138970;ANTONIO BARBOSA PINTO E M ED I E FUND;GUARAQUECABA;PR
OI;30/12/2008;41139186;MARCILIO DIAS C E E FUND MEDIO;GUARAQUECABA;PR
OI;30/12/2009;41139542;ADOLPHO VERCESI E M ED INF ENS FUND;GUARATUBA;PR
OI;30/12/2008;41139623;GRATULINO DE FREITAS C E E MEDIO NORM;GUARATUBA;PR
OI;30/12/2008;41139631;HEINZ WITTITZ E M VER ED INF E FUND;GUARATUBA;PR
OI;30/12/2008;41139640;IRACI MIRANDA KRUGER E M PROFA E I E F;GUARATUBA;PR
OI;30/12/2008;41139658;JOAQUIM DA S MAFRA C E PREF E FUN MED;GUARATUBA;PR
OI;30/12/2008;41139674;MAXIMO JAMUR E M ED INF ENS FUND;GUARATUBA;PR
OI;30/12/2008;41139682;OLGA SILVEIRA E M PROFA ED INF E FUND;GUARATUBA;PR
OI;30/12/2008;41139747;DE PLACIDO E SILVA E M DR ED INF FUND;GUARATUBA;PR
OI;30/12/2009;41139780;JURACI L P CORREA E M PROFA E INF E FUN;GUARATUBA;PR
OI;30/12/2009;41139879;SEBASTIAO S DE SOUZA E M E INF FUND;GUARATUBA;PR
OI;30/12/2008;41139887;29 DE ABRIL C E E FUND MEDIO;GUARATUBA;PR
