OI;29/12/2012;11014172;EEEF JARDIM DOS MIGRANTES;JI-PARANA;RO
OI;30/12/2008;11014300;EEEFM JUSCELINO KUBITSCHEK DE OLIVEIRA;JI-PARANA;RO
OI;30/12/2008;11014431;EEEFM MARCOS BISPO SILVA;JI-PARANA;RO
OI;26/12/2012;11014555;EEEFM NOVA BRASILIA;JI-PARANA;RO
OI;28/07/2011;11014636;EEEF OSVALDO PIANA;JI-PARANA;RO
OI;30/12/2009;11014806;EEEF PROF CARMEM ROCHA BORGES;JI-PARANA;RO
OI;30/12/2009;11014830;EEEF M PROFª EDILCE DOS SANTOS FREITAS;JI-PARANA;RO
OI;30/12/2008;11015144;EEEFM RIO URUPA;JI-PARANA;RO
OI;30/12/2009;11015357;ESCOLA ESTADUAL DE ENSINO FUNDAMENTAL SAO PEDRO;JI-PARANA;RO
OI;26/12/2012;11015411;EEEF TANCREDO DE ALMEIDA NEVES;JI-PARANA;RO
OI;01/07/2010;11015446;CEEJA TERESA MITSUKO TUSTUMI;JI-PARANA;RO
OI;28/12/2012;11015608;EEEFM ALUIZIO FERREIRA;JI-PARANA;RO
OI;30/12/2008;11015624;EEEFM GONCALVES DIAS;JI-PARANA;RO
OI;30/12/2008;11015632;EEEFM JULIO GUERRA;JI-PARANA;RO
OI;20/12/2012;11015667;EEEFM LAURO BENNO PREDIGER;JI-PARANA;RO
OI;30/12/2008;11015683;EEEFM PROF JOSE FRANCISCO DOS SANTOS;JI-PARANA;RO
OI;28/12/2012;11016019;EEEF SAO FRANCISCO;JI-PARANA;RO
OI;30/12/2008;11016094;IEE MARECHAL RONDON;JI-PARANA;RO
OI;01/05/2010;11016230;CEEJA PROF ANTONIO DE ALMEIDA;OURO PRETO DO OESTE;RO
OI;30/12/2009;11016507;EEEFM AURELIO BUARQUE DE HOLANDA;OURO PRETO DO OESTE;RO
OI;30/12/2009;11016558;EMEF BENJAMIN CONSTANT;OURO PRETO DO OESTE;RO
OI;30/12/2009;11016817;EMEF FERNANDO DE AZEVEDO;OURO PRETO DO OESTE;RO
OI;30/12/2008;11016973;EEEFM DR HORACIO CARELLI MENDES;OURO PRETO DO OESTE;RO
OI;30/12/2008;11017023;EEEF JOAQUIM NABUCO;OURO PRETO DO OESTE;RO
OI;30/12/2009;11017120;EEEFM MARIA GORETTI;NOVA UNIAO;RO
OI;30/12/2008;11017201;EEEFM MONTEIRO LOBATO;OURO PRETO DO OESTE;RO
OI;30/12/2008;11017384;EEEFM PIONEIRA;TEIXEIROPOLIS;RO
OI;30/07/2011;11017422;EEEFM MARIA DE MATOS E SILVA;OURO PRETO DO OESTE;RO
OI;30/12/2009;11017430;EEEF PROFª MARGARIDA CUSTODIO DE SO;OURO PRETO DO OESTE;RO
OI;30/12/2008;11017775;EEEFM 28 DE NOVEMBRO;OURO PRETO DO OESTE;RO
OI;30/12/2009;11017791;EEEFM JOAQUIM DE LIMA AVELINO;OURO PRETO DO OESTE;RO
OI;01/06/2010;11017856;CEEJA MARECHAL RONDON;PRESIDENTE MEDICI;RO
OI;30/12/2009;11017872;EMEF PROF LUIZ CAPILLA;PRESIDENTE MEDICI;RO
OI;30/12/2009;11017899;EEEFM 15 DE NOVEMBRO;PRESIDENTE MEDICI;RO
OI;30/12/2008;11018089;EEEFM CARLOS DRUMOND DE ANDRADE;PRESIDENTE MEDICI;RO
OI;30/12/2008;11018810;EEEFM PROF PAULO FREIRE;PRESIDENTE MEDICI;RO
OI;30/12/2008;11018950;EEEFM PRESIDENTE EMILIO GARRASTAZU;PRESIDENTE MEDICI;RO
OI;30/12/2008;11019140;EEEFM COSTA JUNIOR;GOVERNADOR JORGE TEIXEIRA;RO
OI;30/12/2009;11019743;EEEF FLORIZEL LAMEGO FERRARI;MIRANTE DA SERRA;RO
OI;30/12/2008;11019948;EEEFM MIGRANTES;MIRANTE DA SERRA;RO
OI;30/12/2008;11020326;EEEFM PRIMAVERA;THEOBROMA;RO
OI;30/12/2008;11020504;EEEFM ALTAMIR BILLY SOARES;URUPA;RO
OI;30/12/2009;11020962;EEEF WALDEMAR HIGINO DE SOUZA;URUPA;RO
OI;30/12/2009;11021403;EEEFM TUBARAO;VALE DO PARAISO;RO
OI;01/07/2010;11021420;CEEJA CECILIA MEIRELES;NOVA BRASILANDIA DOESTE;RO
OI;08/01/2013;11022060;EEEF PROF ABILIO NETTO BORGES;NOVA BRASILANDIA DOESTE;RO
OI;30/12/2009;11022205;EEEF ROCHA POMBO;NOVA BRASILANDIA DOESTE;RO
OI;30/12/2009;11022221;EEEFM AURELIO BUARQUE DE HOLAND;NOVA BRASILANDIA DOESTE;RO
OI;30/12/2008;11022230;EEEF ALEXANDRE DE GUSMAO;NOVA BRASILANDIA DOESTE;RO
OI;01/06/2010;11022256;CEEJA GETULIO VARGAS;SAO MIGUEL DO GUAPORE;RO
OI;30/12/2009;11022450;EEEF DEONILDO CARAGNATTO;SAO MIGUEL DO GUAPORE;RO
OI;30/12/2009;11022884;EEEF RUI BARBOSA DE OLIVEIRA;SERINGUEIRAS;RO
OI;30/12/2008;11022981;EEEFM PRINCESA ISABEL;SAO MIGUEL DO GUAPORE;RO
OI;01/06/2010;11022990;EMEIEF TIO TECO;SAO MIGUEL DO GUAPORE;RO
OI;01/12/2010;11023023;CEEJA EUCLIDES DA CUNHA;ALVORADA DOESTE;RO
OI;30/12/2008;11023430;EEEF MONTE ALEGRE;ALVORADA DOESTE;RO
OI;04/01/2012;11023449;EMEF MONTEIRO LOBATO;ALVORADA DOESTE;RO
OI;30/12/2008;11023660;EEEFM JOAQUIM XAVIER DE OLIVEIRA;ALVORADA DOESTE;RO
OI;30/12/2008;11023678;;ALVORADA DOESTE;RO
OI;01/09/2010;11023708;EMEI BRANCA DE NEVE;ALVORADA DOESTE;RO
OI;30/12/2008;11024097;EEEFM OSWALDO PIANA;SERINGUEIRAS;RO
OI;01/08/2010;11024275;CEEJA LUIZ VAZ DE CAMOES;ALTA FLORESTA DOESTE;RO
OI;30/12/2008;11024437;EEEFM ARTUR DA COSTA E SILVA;ALTO ALEGRE DOS PARECIS;RO
OI;30/12/2009;11024682;EEEF EURIDICE LOPES PEDROSO;ALTA FLORESTA DOESTE;RO
OI;30/12/2009;11024968;;ALTA FLORESTA DOESTE;RO
OI;30/12/2009;11025620;EEEF TANCREDO DE ALMEIDA NEVES;ALTA FLORESTA DOESTE;RO
OI;30/12/2009;11025638;EEEFM PE EZEQUIEL RAMIN;ALTA FLORESTA DOESTE;RO
OI;30/12/2009;11025654;EMEIEF FLORESTA ENCANTADA;ALTA FLORESTA DOESTE;RO
OI;01/09/2010;11025697;CEEJA AIDA FIBIGER DE OLIVEIRA;CACOAL;RO
OI;30/12/2009;11026014;EEEFM ANTONIO GONCALVES DIAS;CACOAL;RO
OI;30/12/2008;11026073;EEEFM AURELIO BUARQUE DE HOLANDA FERREIRA;CACOAL;RO
OI;30/12/2008;11026197;EEEFM CARLOS DRUMMOND DE ANDRADE;CACOAL;RO
OI;30/12/2008;11026278;EEEFM CORA CORALINA;CACOAL;RO
OI;30/12/2009;11026464;EEEF FREI CANECA;CACOAL;RO
OI;30/12/2009;11026499;EEEFM GRACILIANO RAMOS;CACOAL;RO
OI;30/12/2008;11026545;EEEFM HONORINA LUCAS DE BRITO;CACOAL;RO
OI;30/12/2009;11026626;EEEFM PAULO FREIRE;CACOAL;RO
OI;30/12/2008;11026758;EEEFM MARIA AURORA DO NASCIMENTO;CACOAL;RO
OI;01/02/2010;11026839;EEEF NOSSA SRA DO CARMO;CACOAL;RO
OI;30/12/2009;11027002;EMEIEF PROF AGUSTINHO GOES DE OLIVEIRA;CACOAL;RO
OI;30/12/2008;11027312;EEEFM BERNARDO GUIMARAES;CACOAL;RO
OI;30/12/2008;11027320;EEEFM CARLOS GOMES;CACOAL;RO
OI;30/12/2008;11027347;EEEFM CLODOALDO NUNES DE ALMEIDA;CACOAL;RO
OI;30/12/2009;11027380;E M E I E F JOSE DE ALMEIDA E SILVA;CACOAL;RO
OI;30/12/2009;11027398;EMEIF LUIZ LENZI;CACOAL;RO
OI;30/12/2008;11027401;EEEFM CELSO FERREIRA DA CUNHA;CACOAL;RO
OI;30/12/2009;11027690;EEEF FERNANDA SOUZA DE PAULA;ESPIGAO DOESTE;RO
OI;30/12/2008;11027754;EEEFM JEAN PIAGET;ESPIGAO DOESTE;RO
OI;30/12/2009;11027762;EEEF JERRIS ADRIANI TURATTI;ESPIGAO DOESTE;RO
OI;30/12/2009;11028394;EEEF VINICIUS DE MORAES;ESPIGAO DOESTE;RO
OI;30/12/2008;11028424;EEEFM SETE DE SETEMBRO;ESPIGAO DOESTE;RO
OI;01/12/2010;11028483;CEEJA CEL JORGE TEIXEIRA DE OLIVEIRA;ROLIM DE MOURA;RO
OI;30/12/2009;11028750;EEEFM CARLOS DRUMOND DE ANDRADE;ROLIM DE MOURA;RO
OI;30/12/2009;11028840;EMEIEF DINA SFAT;ROLIM DE MOURA;RO
OI;10/09/2011;11029056;EEEFM JOSE ROSALES DOS SANTOS;ROLIM DE MOURA;RO
OI;30/12/2008;11029099;EEEF MARIA COMANDOLLI LIRA;ROLIM DE MOURA;RO
OI;30/12/2008;11029110;EEEFM MARIA DO CARMO OLIVEIRA RABELO;ROLIM DE MOURA;RO
OI;30/12/2009;11029161;EEEF MONTEIRO LOBATO;ROLIM DE MOURA;RO
OI;30/12/2008;11029170;EEEFM NILSON SILVA;ROLIM DE MOURA;RO
OI;30/12/2009;11029307;EEEFM PRISCILA RODRIGUES CHAGAS;ROLIM DE MOURA;RO
OI;30/12/2009;11029412;EEEF ULISSES GUIMARAES;ROLIM DE MOURA;RO
OI;30/12/2008;11029439;EEEFM CANDIDO PORTINARI;ROLIM DE MOURA;RO
OI;30/12/2008;11029455;EEEFM CEL ALUIZIO PINHEIRO FERREIRA;ROLIM DE MOURA;RO
OI;;11029480;EEEFM TANCREDO DE ALMEIDA NEVES;ROLIM DE MOURA;RO
OI;01/06/2010;11029510;CEEJA DOMINGOS VONA;SANTA LUZIA DOESTE;RO
OI;30/12/2009;11029749;EEEF MARECHAL RONDON;SANTA LUZIA DOESTE;RO
OI;30/12/2008;11029951;EEEFM JUSCELINO KUBITSCHEK;SANTA LUZIA DOESTE;RO
OI;09/01/2012;11030003;EEEFM AMERICO BRASILIENSE DE A;NOVO HORIZONTE DO OESTE;RO
OI;30/12/2008;11030372;EEEFM MAL CANDIDO RONDON;NOVO HORIZONTE DO OESTE;RO
OI;30/12/2008;11030666;EEEFM FRANCISCA JULIA DA SILVA;CASTANHEIRAS;RO
OI;30/12/2008;11031298;EEEFM NILO COELHO;MINISTRO ANDREAZZA;RO
OI;01/08/2010;11031441;CEEJA GLICERIA MARIA OLIVEIRA CRIVELLI;PIMENTA BUENO;RO
OI;30/12/2008;11031549;EEEF ANISIO SERRAO DE CARVALHO;PIMENTA BUENO;RO
OI;30/12/2008;11031689;EEEFM BENEDITO LAURINDO GONCALVES;PARECIS;RO
OI;30/12/2009;11031700;EEEF BOM SUCESSO;PIMENTA BUENO;RO
OI;30/12/2008;11031964;EEEFM FELIPE CAMARAO;SAO FELIPE DOESTE;RO
OI;;11032030;EEEF FREI SILVESTRE BIZZOTTO;PIMENTA BUENO;RO
OI;30/12/2008;11032189;EEFM JOSE SEVERINO DOS SANTOS;PRIMAVERA DE RONDONIA;RO
OI;30/12/2008;11032260;EEEFM MARECHAL CORDEIRO DE FARIAS;PIMENTA BUENO;RO
OI;30/12/2009;11032308;EMEF MARIA CONCEICAO R A CRIVELLI;PIMENTA BUENO;RO
OI;06/03/2012;11032359;EEEFM MONTEIRO LOBATO;SAO FELIPE DOESTE;RO
OI;30/12/2009;11032375;EMEIEF NAIR BARROS;PIMENTA BUENO;RO
OI;28/07/2011;11032510;EEEFM ORLANDO BUENO DA SILVA;PIMENTA BUENO;RO
OI;30/12/2008;11032642;EMEIEF PROFESSORA LAIRCE SANTIAGO MAINA;PIMENTA BUENO;RO
OI;30/12/2009;11032774;EEEF SANDOVAL MEIRA;PIMENTA BUENO;RO
OI;30/12/2008;11033070;EEEFM RAIMUNDO EUCLIDES BARBOSA;PIMENTA BUENO;RO
OI;01/09/2010;11033193;CEEJA VILHENA;VILHENA;RO
OI;30/12/2009;11033240;EMEIEF MARIO GRASSO;VILHENA;RO
OI;30/12/2009;11033266;EMEIEF- ABILIO JULIANO NICOLIELO NETO;VILHENA;RO
OI;30/12/2008;11033347;EMEF CASTELO BRANCO;VILHENA;RO
OI;30/12/2009;11033363;EEEFM CECILIA MEIRELES;VILHENA;RO
OI;30/12/2008;11033371;EEEFM CHUPINGUAIA;CHUPINGUAIA;RO
OI;30/12/2009;11033398;EEEF MARIZETI MENDES DE OLIVEIRA;VILHENA;RO
OI;01/04/2011;11033428;EEEF DEPUTADO GENIVAL NUNES DA COSTA;VILHENA;RO
OI;30/12/2008;11033487;EEEFM MACHADO DE ASSIS;VILHENA;RO
OI;30/12/2009;11033576;EEEF PAULO FREIRE;VILHENA;RO
OI;;11033649;E E E F M MARIA ARLETE TOLEDO;VILHENA;RO
OI;30/12/2008;11033657;EMEF PROF ª IVETE BRUSTOLIN;VILHENA;RO
OI;01/04/2011;11033673;EMEF PROFª VILMA VIEIRA;VILHENA;RO
OI;30/12/2009;11033797;EEEFM ALVARES DE AZEVEDO;VILHENA;RO
OI;30/12/2008;11033819;EEEFM MARECHAL RONDON;VILHENA;RO
OI;30/12/2008;11033827;IEE WILSON CAMARGO;VILHENA;RO
OI;30/12/2008;11033835;EEEFM ZILDA DA FROTA UCHOA;VILHENA;RO
OI;01/08/2010;11033924;CEEJA 6 DE JULHO;CABIXI;RO
OI;30/12/2008;11034440;EEEFM JOSE DE ANCHIETA;CABIXI;RO
OI;01/06/2010;11034467;CEEJA CARLOS DRUMOND DE ANDRADE;CEREJEIRAS;RO
OI;30/12/2009;11034610;EEEF CEL JORGE TEIXEIRA DE OLIVEIRA;CEREJEIRAS;RO
OI;30/12/2009;11034696;E E E F FLORIANO PEIXOTO;CEREJEIRAS;RO
OI;30/12/2009;11034750;EEEF IRMA DULCE;CEREJEIRAS;RO
OI;30/12/2009;11034777;EEEF GOV JERONIMO GARCIA SANTANA;CEREJEIRAS;RO
OI;30/12/2009;11034955;EMEIEF REGINA SPERFELD SEBOLD;CEREJEIRAS;RO
OI;30/12/2008;11034998;EEEFM TANCREDO DE ALMEIDA NEVES;CEREJEIRAS;RO
OI;30/12/2009;11035056;EEEFM CASTRO ALVES;CEREJEIRAS;RO
OI;30/12/2009;11035072;EMEIEF MUNDO DA CRIANCA;CEREJEIRAS;RO
OI;30/12/2009;11035080;EEEFM INACIO CASTRO;PIMENTEIRAS DO OESTE;RO
OI;01/05/2010;11035099;CEEJA TANCREDO NEVES;COLORADO DO OESTE;RO
OI;30/12/2009;11035110;EEEFM 16 DE JUNHO;COLORADO DO OESTE;RO
OI;30/12/2009;11036486;E E E F M DR OSVALDO PIANA;CORUMBIARA;RO
OI;30/12/2009;11036575;EEEF SAO ROQUE;CORUMBIARA;RO
OI;01/04/2011;11036800;EMEIEF SONHO MEU;ARIQUEMES;RO
OI;01/09/2010;11037237;CEEJA DONIZETE ROMUALDO DA SILVA;ESPIGAO DOESTE;RO
OI;30/12/2009;11037334;EEEFM PROF VALDIR MONFREDINHO;PIMENTA BUENO;RO
OI;30/12/2008;11037393;EMEF AYRTON SENNA ADMIN SEDUC-RO;MACHADINHO DOESTE;RO
OI;30/12/2009;11037431;ESCOLA MUNICIPAL DE EDUCACAO INFANTIL;MINISTRO ANDREAZZA;RO
OI;30/12/2009;11037440;EEEFS RONALDO ARAGAO;VILHENA;RO
OI;30/12/2009;11037482;EMEIEF SAO MIGUEL;PORTO VELHO;RO
OI;06/07/2011;11037512;EMEIEF CHAPEUZINHO VERMELHO;PORTO VELHO;RO
OI;30/12/2009;11037598;EEEF SANTA CLARA DE ASSIS;PORTO VELHO;RO
OI;01/05/2010;11037601;CEEJA PE MORETTI;PORTO VELHO;RO
OI;30/12/2009;11037636;EMEF PROFESSOR PEDRO TAVARES BATALHA;PORTO VELHO;RO
OI;30/12/2009;11037644;EMEF RAIMUNDO AGOSTINHO DA SILVA;PORTO VELHO;RO
OI;30/12/2008;11037695;ESCOLA M E I E F JAMIL VILAS BOAS;JI-PARANA;RO
OI;30/12/2009;11037733;EMEIEF MEU PEQUENO JONES;PORTO VELHO;RO
OI;30/12/2009;11037865;EMEF ULISSES SOARES FERREIRA;PORTO VELHO;RO
OI;08/07/2011;11037903;CENTRO EDUCACIONAL MARIA DE NAZARE;PORTO VELHO;RO
OI;24/02/2012;11038063;EEEFM ULISSES GUIMARAES;PORTO VELHO;RO
OI;30/12/2009;11038136;EMEIEF EDSON DUARTE LOPES;MIRANTE DA SERRA;RO
OI;30/12/2009;11038160;EMEF MARCOS VINICIUS CRUZ DE MORAIS;MONTE NEGRO;RO
OI;30/12/2009;11039841;EMEIEF CHICO SOLDADO;CABIXI;RO
OI;30/12/2008;11040041;CENTRO MUNICIPAL DE EDUCACAO INFANTIL;JI-PARANA;RO
OI;01/04/2011;11040319;CEEJA ENALDO LUCAS DE OLIVEIRA;URUPA;RO
OI;20/07/2011;11040432;EMEIEF RONDOMINAS;OURO PRETO DO OESTE;RO
OI;01/09/2010;11040742;EMEI VOVO GINOCA;CANDEIAS DO JAMARI;RO
OI;30/12/2009;11040793;EEEB PROF JOAO BENTO DA COSTA;PORTO VELHO;RO
OI;30/12/2009;11040882;EEEF JOAO FRANCISCO CORREIA;ITAPUA DO OESTE;RO
OI;01/06/2010;11040904;EMEI RUTH VIEIRA BEXIGA;CACOAL;RO
OI;30/12/2009;11040920;EMEF SENADOR DARCY RIBEIRO;PORTO VELHO;RO
OI;30/12/2008;11040947;EMEIF EDUCANDARIO PAULO FREIRE;ALTO ALEGRE DOS PARECIS;RO
OI;30/12/2009;11041048;EMEIEF AREAL DA FLORESTA;PORTO VELHO;RO
OI;30/12/2009;11041196;EMEF SEBASTIAO AMORIM DA SILVA;TEIXEIROPOLIS;RO
OI;01/09/2010;11043059;CEMJA PROFESSORA MARIA PAULINA;GOVERNADOR JORGE TEIXEIRA;RO
OI;30/12/2009;11043334;EMEF ARMINDO FERREIRA FRAGA;GOVERNADOR JORGE TEIXEIRA;RO
OI;30/12/2009;11043385;EMEF PROF MARCOS ADRIANO ISSLER;NOVA UNIAO;RO
OI;30/12/2008;11043458;EMEIEF PROFª MARIA LIBERTY DE FREITAS;GUAJARA-MIRIM;RO
OI;30/12/2008;11043598;EMEIEF GEONE SILVA FERREIRA;SAO FELIPE DOESTE;RO
OI;30/12/2008;11043601;;CHUPINGUAIA;RO
OI;30/12/2008;11043610;EMEIEF JOSE CESTARI;PARECIS;RO
OI;27/09/2016;11043660;EMEI BIANCA E LEONARDO DE MATTOS BEZERRA;VILHENA;RO
OI;29/09/2016;11043679;ESCOLA MUNICIPAL DE EDUCACAO INFANTIL SANTA LUZIA;VILHENA;RO
OI;29/02/2012;11106808;;JI-PARANA;RO
OI;28/09/2012;11106859;EEEFM MOACYR CARAMELLO;CHUPINGUAIA;RO
OI;20/12/2012;11106867;EEEFM SHIRLEI CERUTI;VILHENA;RO
OI;01/07/2010;12000094;ESC COLEGIO CRISTAO CRUZEIRO;CRUZEIRO DO SUL;AC
OI;17/11/2009;12000108;ESC PRESIDENTE TANCREDO DE ALMEIDA NEVES;CRUZEIRO DO SUL;AC
OI;18/11/2009;12000167;ESC ABSOLON MOREIRA;CRUZEIRO DO SUL;AC
OI;07/01/2013;12000213;ESC ANSELMO MAIA DE CARVALHO;CRUZEIRO DO SUL;AC
OI;07/01/2013;12000345;ESC CEL CONTREIRAS;CRUZEIRO DO SUL;AC
OI;18/11/2009;12000396;ESC CORAZITA NEGREIROS;CRUZEIRO DO SUL;AC
OI;14/11/2009;12000418;ESC FLODOARDO CABRAL;CRUZEIRO DO SUL;AC
OI;14/11/2009;12000434;ESC BARAO DO RIO BRANCO;CRUZEIRO DO SUL;AC
OI;14/11/2009;12000442;ESC COMANDANTE BRAZ DE AGUIAR;CRUZEIRO DO SUL;AC
OI;09/12/2009;12000450;ESC CRAVEIRO COSTA;CRUZEIRO DO SUL;AC
OI;01/07/2010;12000531;ESC DR VALERIO CALDAS DE MAGALHAES;CRUZEIRO DO SUL;AC
OI;01/12/2009;12000574;ESC FRANCISCA BARROS DE OLIVEIRA;CRUZEIRO DO SUL;AC
OI;18/11/2009;12000590;ESC FRANCISCA RITA DE CASSIA LIMA PINTO;CRUZEIRO DO SUL;AC
OI;17/11/2009;12000663;ESC GOVERNADOR HUGO CARNEIRO;CRUZEIRO DO SUL;AC
OI;14/11/2009;12000736;ESC JOAO KUBITSCHEK;CRUZEIRO DO SUL;AC
OI;17/11/2009;12000876;ESC LUIZ ANTONIO MEIRIM PEDREIRA;CRUZEIRO DO SUL;AC
OI;01/12/2010;12000914;ESC MADRE ADELGUNDES BECKER;CRUZEIRO DO SUL;AC
OI;18/11/2009;12001007;ESC MARIA DA CONCEICAO CASTRO DE LIMA;CRUZEIRO DO SUL;AC
OI;17/11/2009;12001066;ESC MUSTAFA ALMEIDA TOBU;CRUZEIRO DO SUL;AC
OI;14/11/2009;12001147;ESC PADRE MARCELINO CHAMPAGNAT;CRUZEIRO DO SUL;AC
OI;17/11/2009;12001163;ESC PADRE CARLOS KUNZ;CRUZEIRO DO SUL;AC
OI;01/04/2011;12001171;ESC PADRE CRISTOVAO FREIRE ARNAUD;CRUZEIRO DO SUL;AC
OI;18/11/2009;12001180;ESC PADRE DAMIAO;CRUZEIRO DO SUL;AC
OI;01/06/2010;12001236;ESC DIVINA PROVIDENCIA;CRUZEIRO DO SUL;AC
OI;01/08/2010;12001791;ESC SAO FRANCISCO;MANCIO LIMA;AC
OI;01/09/2010;12001805;ESC 1º DE MAIO;MANCIO LIMA;AC
OI;01/09/2010;12001945;ESC ANTONIO OLIVEIRA DANTAS;MANCIO LIMA;AC
OI;01/08/2010;12001953;ESC ARTUR LEBRE;MANCIO LIMA;AC
OI;01/08/2010;12001961;ESC BELARMINO DE MENDONCA;MANCIO LIMA;AC
OI;06/01/2012;12002046;ESC FRANCISCO FREIRE DE CARVALHO;MANCIO LIMA;AC
OI;01/08/2010;12002267;ESC PADRE EDSON DE OLIVEIRA DANTAS;MANCIO LIMA;AC
OI;01/09/2010;12002771;ESC JUSTINIANO DE SERPA;MARECHAL THAUMATURGO;AC
OI;01/04/2011;12003050;ESC BORGES DE AQUINO;PORTO WALTER;AC
OI;01/12/2010;12003590;ESC CUNHA VASCONCELOS;RODRIGUES ALVES;AC
OI;01/12/2010;12003875;ESC PEDRO DE MELO CORREIA;RODRIGUES ALVES;AC
OI;03/11/2009;12003930;ESC NANZIO MAGALHAES;FEIJO;AC
OI;31/08/2009;12004154;ESC IMACULADA CONCEICAO;FEIJO;AC
OI;31/08/2009;12004170;ESC RAIMUNDO AUGUSTO DE ARAUJO;FEIJO;AC
OI;12/11/2009;12004197;ESC JOSE GURGEL RABELO;FEIJO;AC
OI;31/08/2009;12004227;ESC DR EIRALDO CARNEIRO DE FRANCA;FEIJO;AC
OI;12/11/2009;12004367;ESC FRANCISCO NUNES LEITAO;FEIJO;AC
OI;03/11/2009;12004987;ESC PROF SEVERINO CORDEIRO;FEIJO;AC
OI;31/08/2009;12005037;ESC VICENTE CELSO BRANDAO;FEIJO;AC
OI;09/01/2013;12005240;ESC MANOEL RODRIGUES DE FARIAS;JORDAO;AC
OI;29/08/2009;12005657;ESC PROF JOSE AUGUSTO DE ARAUJO;TARAUACA;AC
OI;10/11/2009;12005681;ESC DELZUITE BARROSO BRAGA DE ARAUJO;TARAUACA;AC
OI;29/08/2009;12005711;ESC DR DJALMA DA CUNHA BATISTA;TARAUACA;AC
OI;02/09/2009;12005770;ESC GOVERNADOR EDMUNDO PINTO DE A NETO;TARAUACA;AC
OI;05/11/2009;12005860;ESC INSTITUTO SAO JOSE;TARAUACA;AC
OI;10/11/2009;12005894;ESC JOAO RIBEIRO;TARAUACA;AC
OI;29/08/2009;12006173;ESC PLACIDO DE CASTRO;TARAUACA;AC
OI;03/09/2009;12006190;ESC TUPANIR GAUDENCIO DA COSTA;TARAUACA;AC
OI;01/08/2010;12006211;ESC MARIA DONIZETE MOTA;TARAUACA;AC
OI;10/11/2009;12006300;ESC ROSAURA MOURAO DA ROCHA;TARAUACA;AC
OI;12/11/2009;12006580;ESC ANTONIA MENDES;MANOEL URBANO;AC
OI;12/11/2009;12006688;ESC DOM PROSPERO BERNARDI;MANOEL URBANO;AC
OI;12/11/2009;12006858;ESC MARIA DAS GRACAS ALVES DA ROCHA;MANOEL URBANO;AC
OI;11/11/2009;12006920;ESC NAZIRA ANUTE DE LIMA;MANOEL URBANO;AC
OI;30/12/2008;12007412;ESC ASSIS VASCONCELOS;SENA MADUREIRA;AC
OI;30/12/2009;12007587;ESC RAIMUNDO HERMINIO DE MELO;SENA MADUREIRA;AC
OI;30/12/2008;12007609;ESC SIQUEIRA DE MENEZES;SENA MADUREIRA;AC
OI;30/12/2008;12007617;ESC DOM JULIO MATTIOLI;SENA MADUREIRA;AC
OI;30/12/2009;12007625;ESC INSTITUTO SANTA JULIANA;SENA MADUREIRA;AC
OI;30/12/2008;12007684;ESC ELIZIARIO TAVORA;SENA MADUREIRA;AC
OI;30/12/2008;12007722;ESC EUGENIO AUGUSTO AREAL;SENA MADUREIRA;AC
OI;30/12/2008;12007757;ESC FONTENELE DE CASTRO;SENA MADUREIRA;AC
OI;30/12/2008;12007820;ESC GUTTEMBERG MODESTO DA COSTA;SENA MADUREIRA;AC
OI;30/12/2009;12011142;ESC ANTONIA FERNANDES DE FREITAS;RIO BRANCO;AC
OI;05/08/2011;12011169;ESC AUREA PIRES MONTES DE SOUZA;RIO BRANCO;AC
OI;30/12/2009;12011401;ESC CLINIO BRANDAO;RIO BRANCO;AC
OI;30/12/2009;12011410;ESC COLEGIO DE APLICACAO UFAC;RIO BRANCO;AC
OI;30/12/2008;12011428;ESC COLEGIO ACREANO;RIO BRANCO;AC
OI;30/12/2009;12011444;ESC COLEGIO ESTADUAL BARAO DO RIO BRANCO;RIO BRANCO;AC
OI;30/12/2008;12011509;ESC DARCY VARGAS;RIO BRANCO;AC
OI;30/12/2009;12011517;ESC DR JOAO BATISTA AGUIAR;RIO BRANCO;AC
OI;30/12/2008;12011550;ESC NEUTEL MAIA;RIO BRANCO;AC
OI;30/12/2008;12011606;ESC ANICE DIB JATENE;RIO BRANCO;AC
OI;07/07/2011;12011614;ESC ANITA GARIBALDI;RIO BRANCO;AC
OI;30/12/2009;12011665;ESC DR CARLOS VASCONCELOS;RIO BRANCO;AC
OI;30/12/2009;12011681;ESC ISMAEL GOMES DE CARVALHO;RIO BRANCO;AC
OI;30/12/2008;12011703;ESC DR MARIO DE OLIVEIRA;RIO BRANCO;AC
OI;30/12/2008;12011711;ESC DR PIMENTEL GOMES;RIO BRANCO;AC
OI;30/12/2008;12011797;ESC GEORGETE ELUAN KALUME;RIO BRANCO;AC
OI;30/12/2009;12011835;ESC IONE PORTELA DA COSTA CASAS;RIO BRANCO;AC
OI;30/12/2008;12011851;ESC IRMA MARIA GABRIELA SOARES;RIO BRANCO;AC
OI;30/12/2009;12011860;ESC JOAO MARIANO DA SILVA;RIO BRANCO;AC
OI;30/12/2009;12011878;ESC JOSE SALES DE ARAUJO;RIO BRANCO;AC
OI;30/12/2008;12011894;ESC LUIZA BATISTA DE SOUZA;RIO BRANCO;AC
OI;30/12/2008;12011924;ESC MARIA LUCIA MOURA MARIN;RIO BRANCO;AC
OI;30/12/2008;12011932;ESC MARILDA GOUVEIA VIANA;RIO BRANCO;AC
OI;30/12/2008;12011959;ESC NATALINO DA SILVEIRA BRITO;RIO BRANCO;AC
OI;30/12/2009;12012009;ESC ALVARO VIEIRA DA ROCHA;RIO BRANCO;AC
OI;30/12/2009;12012017;ESC HUMBERTO SOARES DA COSTA;RIO BRANCO;AC
OI;30/12/2008;12012025;ESC MARIA CHALUB LEITE;RIO BRANCO;AC
OI;30/12/2009;12012041;ESC REINALDO PEREIRA DA SILVA;RIO BRANCO;AC
OI;30/12/2009;12012050;ESC RAIMUNDO HERMINIO DE MELO;RIO BRANCO;AC
OI;30/12/2009;12012068;ESC RAMONA MULA PASTOR DE CASTRO;RIO BRANCO;AC
OI;30/12/2009;12012076;ESC ROBERTO SANCHES MUBARAC;RIO BRANCO;AC
OI;30/12/2008;12012092;ESC SAMUEL BARREIRA;RIO BRANCO;AC
OI;30/12/2009;12012106;ESC SENADOR ADALBERTO SENA;RIO BRANCO;AC
OI;30/12/2008;12012130;ESC ZULEIDE PEREIRA DE SOUZA;RIO BRANCO;AC
OI;30/12/2009;12012165;ESC CHICO MENDES;RIO BRANCO;AC
OI;30/12/2009;12013048;ESC JOSE POTYGUARA;RIO BRANCO;AC
OI;30/12/2009;12013056;ESC JUVENAL ANTUNES;RIO BRANCO;AC
OI;30/12/2008;12013099;ESC PADRE PEREGRINO CARNEIRO DE LIMA;RIO BRANCO;AC
OI;30/12/2008;12013242;ESC PADRE CARLOS CASAVECCHIA;RIO BRANCO;AC
OI;30/12/2008;12013293;ESC PADRE DIOGO FEIJO;RIO BRANCO;AC
OI;14/03/2014;12013340;ESC COLEGIO PRESBITERIANO JOAO CALVINO;RIO BRANCO;AC
OI;30/12/2009;12013374;ESC PROF BERTA VIEIRA DE ANDRADE;RIO BRANCO;AC
OI;30/12/2009;12013404;ESC ELOZIRA DOS SANTOS THOME;RIO BRANCO;AC
OI;30/12/2008;12013455;ESC MARIA RAIMUNDA BALBINO;RIO BRANCO;AC
OI;30/12/2009;12013471;ESC RAIMUNDO GOMES DE OLIVEIRA;RIO BRANCO;AC
OI;30/12/2009;12013498;ESC MARIA ANGELICA DE CASTRO;RIO BRANCO;AC
OI;30/12/2008;12013730;ESC SAO FRANCISCO DE ASSIS I;RIO BRANCO;AC
OI;01/04/2011;12013889;ESC SERAFIM DA SILVA SALGADO;RIO BRANCO;AC
OI;01/12/2010;12013897;ESC SHEILA MARIA MENDES NASSERALA;RIO BRANCO;AC
OI;30/12/2009;12014052;ESC TANCREDO DE ALMEIDA NEVES;RIO BRANCO;AC
OI;30/12/2009;12014060;ESC THEODOLINA FALCAO MACEDO;RIO BRANCO;AC
OI;30/12/2009;12014354;ESC FREI THIAGO MARIA MATIOLLI;RIO BRANCO;AC
OI;01/07/2010;12014389;ESC INSTITUTO SAO JOSE;RIO BRANCO;AC
OI;30/12/2008;12014532;ESC BRIGADEIRO EDUARDO GOMES;SENADOR GUIOMARD;AC
OI;30/12/2009;12014540;ESC CARLOS ALBERTO PEREIRA DO NASCIMENTO;SENADOR GUIOMARD;AC
OI;30/12/2009;12014591;ESC 15 DE JUNHO;SENADOR GUIOMARD;AC
OI;30/12/2008;12014605;ESC SANTO IZIDORO;SENADOR GUIOMARD;AC
OI;30/12/2009;12014648;ESC FENELON MANOEL;SENADOR GUIOMARD;AC
OI;30/12/2009;12014923;ESC ALBERTO ZAIRE;SENADOR GUIOMARD;AC
OI;30/12/2009;12014931;ESC PROF DIVA PEREIRA DE SOUZA;SENADOR GUIOMARD;AC
OI;30/12/2008;12018805;ESC ELSON DIAS DANTAS;BRASILEIA;AC
OI;29/08/2008;12018821;ESC RAIMUNDA DA CUNHA AIRES;EPITACIOLANDIA;AC
OI;30/12/2008;12019135;ESC JOSE FRANCISCO DA SILVA;PLACIDO DE CASTRO;AC
OI;30/12/2008;12019151;ESC FRANCISCO AUGUSTO BACURAU;RIO BRANCO;AC
OI;12/09/2016;12026301;ESC INFANTIL FRANCISCA RODRIGUES RIBEIRO;MANCIO LIMA;AC
OI;01/09/2010;12026328;ESC ELVIRA FERREIRA GOMES;MARECHAL THAUMATURGO;AC
OI;01/09/2010;12029807;ESC MARIA FERREIRA DO VALE;MARECHAL THAUMATURGO;AC
OI;08/07/2011;12030066;ESC VALDINA TORQUATO DO NASCIMENTO;TARAUACA;AC
OI;01/12/2010;12030104;ESC JULIA MARIA DE SANTANA AMORIM;RODRIGUES ALVES;AC
OI;09/01/2013;12030155;ESC JAIRO DE FIGUEIREDO MELO;JORDAO;AC
OI;28/07/2013;12030562;ESC DARQUINHO;RIO BRANCO;AC
OI;17/03/2016;12030708;ESC CRECHE VOVO AURELIANO;MANCIO LIMA;AC
OI;15/12/2014;12030937;INSTITUTO FEDERAL DO ACRE;CRUZEIRO DO SUL;AC
OI;24/06/2014;12030961;INSTITUTO FEDERAL DO ACRE;RIO BRANCO;AC
OI;25/08/2017;12031674;ESC BELO PORVIR;EPITACIOLANDIA;AC
OI;21/10/2015;12031720;ESC WALFREDO GUEDES MONTEIRO;SENA MADUREIRA;AC
OI;24/03/2015;12032026;ESC USINA DE ARTE;RIO BRANCO;AC
OI;06/04/2016;12032093;INSTITUTO FEDERAL DO ACRE;RIO BRANCO;AC
OI;29/08/2017;12032115;ESC PROF MARINA VICENTE GOMES;RIO BRANCO;AC
OI;12/09/2016;12032123;ESC PROFESSORA NEUSA AMANCIO SABINO;MANCIO LIMA;AC
OI;28/12/2012;12091235;ESC GOVERNADOR JOSE AUGUSTO;RIO BRANCO;AC
OI;01/12/2010;12091243;ESC JOAO EDUARDO;RIO BRANCO;AC
OI;13/05/2011;12091251;ESC PROF TEREZINHA MIGUEIS;RIO BRANCO;AC
OI;28/12/2012;12091260;ESC BOA UNIAO ENSINO JOVEM;RIO BRANCO;AC
OI;30/12/2008;17000017;COL EST GETULIO VARGAS;ANANAS;TO
OI;30/12/2008;17000033;ESC EST ANTONIO ALVES MOREIRA;ANANAS;TO
OI;30/12/2008;17000050;ESC EVANGELICA GUNNAR VINGREN;ANANAS;TO
OI;30/12/2008;17000068;ESC MUL B CHAPADINHA II;ANANAS;TO
OI;30/12/2008;17000092;ESC MUL DO BAIRRO CHAPADINHA I;ANANAS;TO
OI;30/12/2008;17000106;ESC MUL JOAO DIAS BORGES;ANANAS;TO
OI;30/12/2009;17000130;ESC MUL MIN MARCOS FREIRE;ANANAS;TO
OI;30/12/2008;17000173;ESCOLA PAROQUIAL SAO PEDRO - CONVENIADA;ANANAS;TO
OI;01/09/2010;17000203;COLEGIO ESTADUAL MAURO BORGES;ANGICO;TO
OI;30/12/2009;17000327;COLEGIO ESTADUAL LEONIDAS GONCALVES DUARTE;ARAGUATINS;TO
OI;30/12/2009;17000378;ESC EST DENISE GOMIDE AMUI;ARAGUATINS;TO
OI;30/12/2009;17000386;ESC EST OSVALDO FRANCO;ARAGUATINS;TO
;30/12/2009;17000823;ESC MUL PROF MARIA DE LOURDES MILHOMEM FERNANDES;ARAGUATINS;TO
OI;30/12/2008;17000840;ESCOLA MUNICIPAL PROFESSORA NAIR DUARTE;ARAGUATINS;TO
OI;30/12/2009;17000971;ESCOLA PAROQUIAL SAO VICENTE FERRER;ARAGUATINS;TO
OI;30/12/2009;17001005;COL EST MANOEL VICENTE DE SOUZA;AUGUSTINOPOLIS;TO
OI;30/12/2009;17001013;ESC EST AUGUSTINOPOLIS;AUGUSTINOPOLIS;TO
OI;30/12/2009;17001030;ESC EST SANTA GENOVEVA;AUGUSTINOPOLIS;TO
OI;30/12/2009;17001048;CENTRO ESTADUAL DE EDUCACAO LA SALLE;AUGUSTINOPOLIS;TO
OI;30/12/2009;17001056;ESCOLA MUNICIPAL BOA VISTA;AUGUSTINOPOLIS;TO
OI;30/12/2009;17001102;ESCOLA MUNICIPAL PEQUENO PRINCIPE;AUGUSTINOPOLIS;TO
OI;30/12/2009;17001110;ESC MUL PRES KENNEDY;AUGUSTINOPOLIS;TO
OI;20/08/2009;17001161;COLEGIO ESTADUAL MARECHAL RIBAS JUNIOR;AXIXA DO TOCANTINS;TO
OI;20/08/2009;17001170;COLEGIO JOAO PAULO II;AXIXA DO TOCANTINS;TO
OI;20/08/2009;17001188;ESC EST SAO FRANCISCO DE ASSIS;AXIXA DO TOCANTINS;TO
OI;01/06/2010;17001200;ESC MUL BOM JESUS;AXIXA DO TOCANTINS;TO
OI;30/07/2011;17001250;ESC MUL IRIS PEDRO DE OLIVEIRA;AXIXA DO TOCANTINS;TO
OI;04/09/2009;17001277;ESC MUL MARECHAL RONDON;AXIXA DO TOCANTINS;TO
OI;01/09/2010;17001293;ESC MUL PADRE IRTON;AXIXA DO TOCANTINS;TO
OI;19/03/2009;17001439;COLEGIO ESTADUAL BURITI;BURITI DO TOCANTINS;TO
OI;19/03/2009;17001463;ESC EST PRES TANCREDO DE ALMEIDA NEVES;BURITI DO TOCANTINS;TO
OI;19/03/2009;17001471;ESC EST VICENTE CARLOS DE SOUSA;BURITI DO TOCANTINS;TO
OI;27/11/2009;17001498;ESC MUL BURITI B;BURITI DO TOCANTINS;TO
OI;19/03/2009;17001510;ESC MUL HENRIQUE ALVES GARCIA;BURITI DO TOCANTINS;TO
OI;19/03/2009;17001536;ESC MUL LUIZ GONZAGA DE SOUSA;BURITI DO TOCANTINS;TO
OI;01/12/2010;17001544;ESC MUL MANOEL PEREIRA DA SILVA;BURITI DO TOCANTINS;TO
OI;01/07/2010;17001595;ESC EST RAIMUNDO NONATO TORRES;CACHOEIRINHA;TO
OI;10/05/2011;17001625;ESCOLA MUL RUI BARBOSA;CACHOEIRINHA;TO
OI;01/12/2010;17001641;PRE-ESCOLAR PEQUENO PRINCIPE;CACHOEIRINHA;TO
OI;01/06/2010;17001650;ESC EST CICERO GOMES DE JESUS;CARRASCO BONITO;TO
OI;01/06/2010;17001714;ESC MUL TIRADENTES;CARRASCO BONITO;TO
